Price per GB,Price per TB,Price,Capacity,Warranty,Form Factor,Technology,Condition,Affiliate Link,Affiliate Link HTML
"€0,136",€136,€17,128 GB,20 years,microSD,Flash,New,"SanDisk 128GB Extreme Go scheda microSDXC + adattatore SD (per smartphones e Tablet Android, Action Cam, Drones, UHS-I, fino a 200 MB/s, 5K, 4K, UHD, V30, Rescue PRO Deluxe, Class 10, U3) per Amazon","<a href=""https://www.amazon.it/dp/B0DCW7MST8"">SanDisk 128GB Extreme Go scheda microSDXC + adattatore SD (per smartphones e Tablet Android, Action Cam, Drones, UHS-I, fino a 200 MB/s, 5K, 4K, UHD, V30, Rescue PRO Deluxe, Class 10, U3) per Amazon</a>"
"€0,137",€137,€35,256 GB,,microSD,Flash,New,"Gigastone Scheda di memoria Micro SDXC da 256 GB Gaming Plus Seriale, Velocità di riproduzione fino a 100 MB/s. Compatibile con Switch Dashcam GoPro Canon Nikon DJI Drone, A1 U3 V30 con adattatore SD.","<a href=""https://www.amazon.it/dp/B07P45BKN9"">Gigastone Scheda di memoria Micro SDXC da 256 GB Gaming Plus Seriale, Velocità di riproduzione fino a 100 MB/s. Compatibile con Switch Dashcam GoPro Canon Nikon DJI Drone, A1 U3 V30 con adattatore SD.</a>"
"€0,137",€137,€35,256 GB,,microSD,Flash,New,"Lexar 256 GB Scheda Micro SD Silver Plus, Scheda di Memoria Flash MicroSDXC UHS-I con Adattatore - fino a 205 MB/s, A2, U3, V30, Class10, TF Card Alta Velocità","<a href=""https://www.amazon.it/dp/B0CZKKKMHQ"">Lexar 256 GB Scheda Micro SD Silver Plus, Scheda di Memoria Flash MicroSDXC UHS-I con Adattatore - fino a 205 MB/s, A2, U3, V30, Class10, TF Card Alta Velocità</a>"
"€0,137",€137,€70,512 GB,,microSD,Flash,New,"Gigastone [5 Anni Recupero Dati Gratuito] Scheda di Memoria 512 GB 4K Fotocamera Pro, Compatibile con GoPro Drone Switch, Velocità 100 MB/s. 4K Video, A2 U3 V30 Scheda Micro SDXC con adattatore SD.","<a href=""https://www.amazon.it/dp/B07Q74GXK7"">Gigastone [5 Anni Recupero Dati Gratuito] Scheda di Memoria 512 GB 4K Fotocamera Pro, Compatibile con GoPro Drone Switch, Velocità 100 MB/s. 4K Video, A2 U3 V30 Scheda Micro SDXC con adattatore SD.</a>"
"€0,138",€138,€9,64 GB,,microSD,Flash,Used,"Samsung Memorie EVO Plus Scheda SD da 64 GB, UHS-I U1, fino a 130 MB/s (MB-SC64K/EU)","<a href=""https://www.amazon.it/dp/B09D3M3VZR"">Samsung Memorie EVO Plus Scheda SD da 64 GB, UHS-I U1, fino a 130 MB/s (MB-SC64K/EU)</a>","<a href=""https://www.amazon.it/dp/B09D3M3VZR"">Samsung Memorie EVO Plus Scheda SD da 64 GB, UHS-I U1, fino a 130 MB/s (MB-SC64K/EU)</a>"
"€0,139",€139,€139,1 TB,,"Internal 3.5""",HDD,New,"Western Digital S0200196 Disco Rigido Red Wd10Efrx 3.5"" Sata III 7200 Rpm Buffer 64 Mb, 1 TB","<a href=""https://www.amazon.it/dp/B07WJM4VYT"">Western Digital S0200196 Disco Rigido Red Wd10Efrx 3.5"" Sata III 7200 Rpm Buffer 64 Mb, 1 TB</a>"
"€0,139",€139,€67,480 GB,3 years,Internal,SSD,New,"SanDisk 480GB Portatile SSD, Unità a stato solido esterna, velocità di lettura fino a 520 MB/s, Nero","<a href=""https://www.amazon.it/dp/B08RSK74K1"">SanDisk 480GB Portatile SSD, Unità a stato solido esterna, velocità di lettura fino a 520 MB/s, Nero</a>"
"€0,140",€140,€36,256 GB,,microSD,Flash,New,Samsung Scheda di memoria Evo plus 256 GB microSD SDXC U3 classe 10 A2 130 MB/S con adattatore versione 2021 (MB-MC256KA/EU),"<a href=""https://www.amazon.it/dp/B09FFD6R2B"">Samsung Scheda di memoria Evo plus 256 GB microSD SDXC U3 classe 10 A2 130 MB/S con adattatore versione 2021 (MB-MC256KA/EU)</a>"
"€0,145",€145,€9,64 GB,,microSD,Flash,New,"Kingston - Scheda di memoria microSDHC da 64 GB Select Plus, 100 MB/s in lettura A1 classe 10 UHS-I senza frustrazione + adattatore (SDCS2/64 GBET)","<a href=""https://www.amazon.it/dp/B083TN8XP4"">Kingston - Scheda di memoria microSDHC da 64 GB Select Plus, 100 MB/s in lettura A1 classe 10 UHS-I senza frustrazione + adattatore (SDCS2/64 GBET)</a>"
"€0,145",€145,€9,32 GB x2,,microSD,Flash,New,"QUMOX, Scheda di memoria microSDHC da 32 GB UHS-I Grade 1, Classe 10, con adattatore SD, 2 pezzi","<a href=""https://www.amazon.it/dp/B00KOGHQZM"">QUMOX, Scheda di memoria microSDHC da 32 GB UHS-I Grade 1, Classe 10, con adattatore SD, 2 pezzi</a>"
"€0,146",€146,€146,1 TB,,M.2,NVMe,New,"Crucial T700 SSD 1TB PCIe Gen5 NVMe M.2 SSD Interno Gaming, Fino a 11.700MB/s, Microsoft DirectStorage, Retrocompatibilità PCIe 4.0 - CT1000T700SSD3","<a href=""https://www.amazon.it/dp/B0C3K1QBSG"">Crucial T700 SSD 1TB PCIe Gen5 NVMe M.2 SSD Interno Gaming, Fino a 11.700MB/s, Microsoft DirectStorage, Retrocompatibilità PCIe 4.0 - CT1000T700SSD3</a>"
"€0,146",€146,€146,1 TB,,External,SSD,New,Samsung T7 Touch Portable SSD - 1 TB - USB 3.2 Gen.2 External SSD Metallic Black (MU-PC1T0K/WW),"<a href=""https://www.amazon.it/dp/B082VW4QCX"">Samsung T7 Touch Portable SSD - 1 TB - USB 3.2 Gen.2 External SSD Metallic Black (MU-PC1T0K/WW)</a>"
"€0,147",€147,€74,500 GB,5 years,External,SSD,New,Kingston XS2000 500GB Drive a stato solido (SDD) esterno USB 3.2 Gen 2 SSD Portatile - SXS2000/500G,"<a href=""https://www.amazon.it/dp/B09F5WJV8R"">Kingston XS2000 500GB Drive a stato solido (SDD) esterno USB 3.2 Gen 2 SSD Portatile - SXS2000/500G</a>","<a href=""https://www.amazon.it/dp/B09F5WJV8R"">Kingston XS2000 500GB Drive a stato solido (SDD) esterno USB 3.2 Gen 2 SSD Portatile - SXS2000/500G</a>"
"€0,148",€148,€38,256 GB,2 years,Internal,SSD,New,Kingston KC600 SSD 256GB SATA3 mSATA - SKC600MS/256G,"<a href=""https://www.amazon.it/dp/B08ZNSNL1K"">Kingston KC600 SSD 256GB SATA3 mSATA - SKC600MS/256G</a>"
"€0,148",€148,€19,128 GB,,microSD,Flash,Used,Samsung Scheda di memoria microSD Evo Plus 128 GB SDXC U3 Classe 10 A2 130 MB/s con adattatore versione 2021 (MB-MC128KA/EU),"<a href=""https://www.amazon.it/dp/B09R4HNX4J"">Samsung Scheda di memoria microSD Evo Plus 128 GB SDXC U3 Classe 10 A2 130 MB/s con adattatore versione 2021 (MB-MC128KA/EU)</a>","<a href=""https://www.amazon.it/dp/B09R4HNX4J"">Samsung Scheda di memoria microSD Evo Plus 128 GB SDXC U3 Classe 10 A2 130 MB/s con adattatore versione 2021 (MB-MC128KA/EU)</a>"
"€0,148",€148,€10,64 GB,,microSD,Flash,Used,"Imou Scheda di Memoria microSDXC 64 GB, fino a 95/25 MB/sec, Classe 10-U1, UHS-I, Micro SD Card per Telefono, Videocamera, Switch, Tablet","<a href=""https://www.amazon.it/dp/B091SHSDJ6"">Imou Scheda di Memoria microSDXC 64 GB, fino a 95/25 MB/sec, Classe 10-U1, UHS-I, Micro SD Card per Telefono, Videocamera, Switch, Tablet</a>","<a href=""https://www.amazon.it/dp/B091SHSDJ6"">Imou Scheda di Memoria microSDXC 64 GB, fino a 95/25 MB/sec, Classe 10-U1, UHS-I, Micro SD Card per Telefono, Videocamera, Switch, Tablet</a>"
"€0,148",€148,€10,64 GB,,SD,Flash,Used,"SanDisk Ultra 64GB SDXC 140MB/s - Scheda di Memoria, con velocità fino a 140 MB/s, prestazioni dell'app A1, UHS-I, Classe 10, U1","<a href=""https://www.amazon.it/dp/B0B7NWR653"">SanDisk Ultra 64GB SDXC 140MB/s - Scheda di Memoria, con velocità fino a 140 MB/s, prestazioni dell'app A1, UHS-I, Classe 10, U1</a>","<a href=""https://www.amazon.it/dp/B0B7NWR653"">SanDisk Ultra 64GB SDXC 140MB/s - Scheda di Memoria, con velocità fino a 140 MB/s, prestazioni dell'app A1, UHS-I, Classe 10, U1</a>"
"€0,149",€149,€5,32 GB,,Compact,Flash,New,"Team Group C145 - Chiavetta USB 3.0, Colore: Giallo 32 GB","<a href=""https://www.amazon.it/dp/B014W280RQ"">Team Group C145 - Chiavetta USB 3.0, Colore: Giallo 32 GB</a>"
"€0,150",€150,€150,1 TB,2 years,External,SSD,New,"WD_BLACK C50 1TB Expansion Card per Xbox, con licenza ufficiale Xbox, SSD compatibile con Xbox Series X|S, abbonamento di 1 mese a Xbox Game Pass.","<a href=""https://www.amazon.it/dp/B0C44XVWCH"">WD_BLACK C50 1TB Expansion Card per Xbox, con licenza ufficiale Xbox, SSD compatibile con Xbox Series X|S, abbonamento di 1 mese a Xbox Game Pass.</a>"
"€0,151",€151,€19,128 GB,,microSD,Flash,New,"Gigastone, scheda di memoria Micro SD da 128 GB, Gaming Plus, scheda di memoria MicroSDXC per Nintendo Switch, Wyze, GoPro, Dash Cam, telecamera di sicurezza, registrazione video 4K, UHS-I A1 U3 V30","<a href=""https://www.amazon.it/dp/B07N7D2WBF"">Gigastone, scheda di memoria Micro SD da 128 GB, Gaming Plus, scheda di memoria MicroSDXC per Nintendo Switch, Wyze, GoPro, Dash Cam, telecamera di sicurezza, registrazione video 4K, UHS-I A1 U3 V30</a>"
"€0,152",€152,€10,64 GB,,SD,Flash,Used,"SanDisk Ultra - Scheda di memoria SDXC da 64 GB, fino a 80 MB/sec, classe 10 (Ricondizionato)","<a href=""https://www.amazon.it/dp/B07VWKLJR5"">SanDisk Ultra - Scheda di memoria SDXC da 64 GB, fino a 80 MB/sec, classe 10 (Ricondizionato)</a>"
"€0,154",€154,€38,250 GB,,External,SSD,New,"PHILIPS SSD portatile esterno 250 GB - Ultra sottile, SATA Ultra Speed USB-C - USB, lettura fino a 540 MB/s, scrittura fino a 520 MB/s, alluminio","<a href=""https://www.amazon.it/dp/B09FY9CBFT"">PHILIPS SSD portatile esterno 250 GB - Ultra sottile, SATA Ultra Speed USB-C - USB, lettura fino a 540 MB/s, scrittura fino a 520 MB/s, alluminio</a>"
"€0,154",€154,€39,256 GB,2 years,External,SSD,New,Verbatim SSD Store 'n' Go Portable - 256 GB - Nero - SSD esterno - SSD USB 3.0 - SSD esterno - per Windows e Mac OS X - unità portatile - USB-C - unità flash esterna,"<a href=""https://www.amazon.it/dp/B086Q319JL"">Verbatim SSD Store 'n' Go Portable - 256 GB - Nero - SSD esterno - SSD USB 3.0 - SSD esterno - per Windows e Mac OS X - unità portatile - USB-C - unità flash esterna</a>"
"€0,155",€155,€20,128 GB,,microSD,Flash,New,"ARCANITE Scheda di memoria microSDXC da 128 GB con adattatore SD - A1, UHS-I U3, V30, 4K, C10, microSD, velocità massima di lettura 90 MB/s","<a href=""https://www.amazon.it/dp/B07RV6N78T"">ARCANITE Scheda di memoria microSDXC da 128 GB con adattatore SD - A1, UHS-I U3, V30, 4K, C10, microSD, velocità massima di lettura 90 MB/s</a>"
"€0,155",€155,€10,64 GB,,microSD,Flash,New,"Imou Scheda di Memoria microSDXC 64 GB, fino a 95/25 MB/sec, Classe 10-U1, UHS-I, Micro SD Card per Telefono, Videocamera, Switch, Tablet","<a href=""https://www.amazon.it/dp/B091SHSDJ6"">Imou Scheda di Memoria microSDXC 64 GB, fino a 95/25 MB/sec, Classe 10-U1, UHS-I, Micro SD Card per Telefono, Videocamera, Switch, Tablet</a>","<a href=""https://www.amazon.it/dp/B091SHSDJ6"">Imou Scheda di Memoria microSDXC 64 GB, fino a 95/25 MB/sec, Classe 10-U1, UHS-I, Micro SD Card per Telefono, Videocamera, Switch, Tablet</a>"
"€0,155",€155,€155,1 TB,,"External 3.5""",HDD,New,"Seagate Game Drive per PS5, 1 TB, USB 3.2 con licenza ufficiale, colore bianco con illuminazione LED blu, 2 anni Rescue Services (STMH1000200)","<a href=""https://www.amazon.it/dp/B0CTN3FGTM"">Seagate Game Drive per PS5, 1 TB, USB 3.2 con licenza ufficiale, colore bianco con illuminazione LED blu, 2 anni Rescue Services (STMH1000200)</a>"
"€0,155",€155,€20,128 GB,,microSD,Flash,Used,"SanDisk 128GB High Endurance microSDXC card for IP & dash cams + SD adapter up to 10,000 Hours Full HD / 4K videos till 100 MB/s UHS-I Class 10 U3 V30","<a href=""https://www.amazon.it/dp/B07NY23WBG"">SanDisk 128GB High Endurance microSDXC card for IP & dash cams + SD adapter up to 10,000 Hours Full HD / 4K videos till 100 MB/s UHS-I Class 10 U3 V30</a>","<a href=""https://www.amazon.it/dp/B07NY23WBG"">SanDisk 128GB High Endurance microSDXC card for IP & dash cams + SD adapter up to 10,000 Hours Full HD / 4K videos till 100 MB/s UHS-I Class 10 U3 V30</a>"
"€0,156",€156,€10,64 GB,,SD,Flash,New,"fanxiang Scheda sd 64GB - Scheda di Memoria SDXC UHS-I fino a 95MB/s in Lettura - Class 10, U3, V30 - SD Card per Fotografi Professionisti, Videografi, Appassionati, Video 4K UHD - KS10","<a href=""https://www.amazon.it/dp/B0DJ2RJ1MT"">fanxiang Scheda sd 64GB - Scheda di Memoria SDXC UHS-I fino a 95MB/s in Lettura - Class 10, U3, V30 - SD Card per Fotografi Professionisti, Videografi, Appassionati, Video 4K UHD - KS10</a>"
"€0,156",€156,€10,64 GB,,microSD,Flash,New,"LinkMore 64GB Scheda Micro SDHC XV11 A1, UHS-I, U1, V10, compatibile con classe 10, velocità di lettura fino a 95 MB/s, adattatore SD incluso","<a href=""https://www.amazon.it/dp/B0C2YSQWVQ"">LinkMore 64GB Scheda Micro SDHC XV11 A1, UHS-I, U1, V10, compatibile con classe 10, velocità di lettura fino a 95 MB/s, adattatore SD incluso</a>"
"€0,156",€156,€20,128 GB,10 years,microSD,Flash,New,"Lexar Micro SD 128 GB, Scheda Micro SD fino a 160/90 MB/s(R/W), Scheda di Memoria microSDXC con Adattatore SD, A2, U3, C10, V30, Micro SD Card","<a href=""https://www.amazon.it/dp/B08XZ4PKKG"">Lexar Micro SD 128 GB, Scheda Micro SD fino a 160/90 MB/s(R/W), Scheda di Memoria microSDXC con Adattatore SD, A2, U3, C10, V30, Micro SD Card</a>"
"€0,156",€156,€20,128 GB,10 years,SD,Flash,New,"Lexar Scheda SD 128 GB, Scheda di Memoria SDXC fino a 120 MB/s in Lettura, fino a 45 MB/s in Scrittura, UHS-I, U3, V30, C10, Full-HD e 4K UHD (LSDESXX128G-BNNNG)","<a href=""https://www.amazon.it/dp/B09S31MQCT"">Lexar Scheda SD 128 GB, Scheda di Memoria SDXC fino a 120 MB/s in Lettura, fino a 45 MB/s in Scrittura, UHS-I, U3, V30, C10, Full-HD e 4K UHD (LSDESXX128G-BNNNG)</a>"
"€0,156",€156,€40,256 GB,5 years,microSD,Flash,New,"[5 Anni Recupero Dati Gratuito] GIGASTONE 256GB Scheda MicroSDXC, Camera Pro MAX, Scheda di Memoria A2 V30 per Gopro, Action Cam, 4K UHD Video, Fino a 130/85 MB/s, UHS-I U3 C10 con adattatore","<a href=""https://www.amazon.it/dp/B0BWJDHQZB"">[5 Anni Recupero Dati Gratuito] GIGASTONE 256GB Scheda MicroSDXC, Camera Pro MAX, Scheda di Memoria A2 V30 per Gopro, Action Cam, 4K UHD Video, Fino a 130/85 MB/s, UHS-I U3 C10 con adattatore</a>"
"€0,156",€156,€40,256 GB,,External,SSD,New,"Netac US9 - Chiavetta USB da 256 GB, fino a 1000 MB/S, SSD portatile, Dual Type-C e USB 3.2, porte esterne a stato solido per telefoni Android di tipo C, laptop, tablet e molto altro ancora","<a href=""https://www.amazon.it/dp/B0D8L78L5F"">Netac US9 - Chiavetta USB da 256 GB, fino a 1000 MB/S, SSD portatile, Dual Type-C e USB 3.2, porte esterne a stato solido per telefoni Android di tipo C, laptop, tablet e molto altro ancora</a>"
"€0,156",€156,€40,256 GB,5 years,External,SSD,New,"fanxiang 256GB Esterno SSD Portatile Chiavetta Usb,Fino a 550 MB/S -Crittografia Delle Impronte Digitali,USB 3.2 Gen2 Type-A + Type-C,Compatibile con Laptops/PC/Phone/Tablet（FP651）","<a href=""https://www.amazon.it/dp/B0DL576BW5"">fanxiang 256GB Esterno SSD Portatile Chiavetta Usb,Fino a 550 MB/S -Crittografia Delle Impronte Digitali,USB 3.2 Gen2 Type-A + Type-C,Compatibile con Laptops/PC/Phone/Tablet（FP651）</a>"
"€0,160",€160,€20,128 GB,,SD,Flash,Used,SanDisk 128GB Extreme PRO scheda SDXC + RescuePro Deluxe fino a 200 MB/s UHS-I Class 10 U3 V30,"<a href=""https://www.amazon.it/dp/B09X7FXHVJ"">SanDisk 128GB Extreme PRO scheda SDXC + RescuePro Deluxe fino a 200 MB/s UHS-I Class 10 U3 V30</a>","<a href=""https://www.amazon.it/dp/B09X7FXHVJ"">SanDisk 128GB Extreme PRO scheda SDXC + RescuePro Deluxe fino a 200 MB/s UHS-I Class 10 U3 V30</a>"
"€0,161",€161,€21,128 GB,,microSD,Flash,New,"SanDisk 128GB High Endurance microSDXC card for IP & dash cams + SD adapter up to 10,000 Hours Full HD / 4K videos till 100 MB/s UHS-I Class 10 U3 V30","<a href=""https://www.amazon.it/dp/B07NY23WBG"">SanDisk 128GB High Endurance microSDXC card for IP & dash cams + SD adapter up to 10,000 Hours Full HD / 4K videos till 100 MB/s UHS-I Class 10 U3 V30</a>","<a href=""https://www.amazon.it/dp/B07NY23WBG"">SanDisk 128GB High Endurance microSDXC card for IP & dash cams + SD adapter up to 10,000 Hours Full HD / 4K videos till 100 MB/s UHS-I Class 10 U3 V30</a>"
"€0,163",€162,€21,128 GB,,microSD,Flash,New,"SanDisk 128 GB Scheda microSDXC Extreme per Action Cams e Drones + adattatore SD + RescuePRO Deluxe, fino a 190 MB/s, con A2 App Performance, UHS-I, Classe 10, U3, V30","<a href=""https://www.amazon.it/dp/B09X7BQB4J"">SanDisk 128 GB Scheda microSDXC Extreme per Action Cams e Drones + adattatore SD + RescuePRO Deluxe, fino a 190 MB/s, con A2 App Performance, UHS-I, Classe 10, U3, V30</a>"
"€0,164",€164,€10,64 GB,,microSD,Flash,Used,"Intenso Scheda di memoria MicroSDXC da 64 GB, Class 10 (con Adattatore SD), Nero","<a href=""https://www.amazon.it/dp/B00FMB9A30"">Intenso Scheda di memoria MicroSDXC da 64 GB, Class 10 (con Adattatore SD), Nero</a>","<a href=""https://www.amazon.it/dp/B00FMB9A30"">Intenso Scheda di memoria MicroSDXC da 64 GB, Class 10 (con Adattatore SD), Nero</a>"
"€0,166",€166,€21,128 GB,,microSD,Flash,New,Samsung Scheda di memoria microSD Evo Plus 128 GB SDXC U3 Classe 10 A2 130 MB/s con adattatore versione 2021 (MB-MC128KA/EU),"<a href=""https://www.amazon.it/dp/B09R4HNX4J"">Samsung Scheda di memoria microSD Evo Plus 128 GB SDXC U3 Classe 10 A2 130 MB/s con adattatore versione 2021 (MB-MC128KA/EU)</a>","<a href=""https://www.amazon.it/dp/B09R4HNX4J"">Samsung Scheda di memoria microSD Evo Plus 128 GB SDXC U3 Classe 10 A2 130 MB/s con adattatore versione 2021 (MB-MC128KA/EU)</a>"
"€0,166",€166,€166,1 TB,,External,SSD,New,Synology BeeDrive 1TB Datensicherung von PC & mobilen Geräten,"<a href=""https://www.amazon.it/dp/B0C6YZHDDL"">Synology BeeDrive 1TB Datensicherung von PC & mobilen Geräten</a>"
"€0,168",€168,€86,512 GB,,External,SSD,Used,ADATA 512GB SE800 External Solid State Drive - Black,"<a href=""https://www.amazon.it/dp/B07V1H44XD"">ADATA 512GB SE800 External Solid State Drive - Black</a>"
"€0,168",€168,€43,256 GB,2 years,microSD,Flash,New,"Reolink 256GB Scheda di Memoria MicroSDHC ad Alta Velocità, Classe 10, Scheda di Memoria A2 U3, Compatibile con Telecamera di Sicurezza Reolink","<a href=""https://www.amazon.it/dp/B0BC92J5KV"">Reolink 256GB Scheda di Memoria MicroSDHC ad Alta Velocità, Classe 10, Scheda di Memoria A2 U3, Compatibile con Telecamera di Sicurezza Reolink</a>"
"€0,170",€170,€170,1 TB,,External,SSD,New,"ORICO SSD portatile 40Gbps RGB, USB4.0 per 3700MB/s, unità a stato solido esterna da 1 TB con cavo USB C 2 in 1, ventola di raffreddamento integrata, compatibile con Thunderbolt 4/3, PSSD - R3700","<a href=""https://www.amazon.it/dp/B0D8KLBKZJ"">ORICO SSD portatile 40Gbps RGB, USB4.0 per 3700MB/s, unità a stato solido esterna da 1 TB con cavo USB C 2 in 1, ventola di raffreddamento integrata, compatibile con Thunderbolt 4/3, PSSD - R3700</a>"
"€0,172",€172,€11,64 GB,,microSD,Flash,New,"Samsung Memorie EVO Plus Scheda SD da 64 GB, UHS-I U1, fino a 130 MB/s (MB-SC64K/EU)","<a href=""https://www.amazon.it/dp/B09D3M3VZR"">Samsung Memorie EVO Plus Scheda SD da 64 GB, UHS-I U1, fino a 130 MB/s (MB-SC64K/EU)</a>","<a href=""https://www.amazon.it/dp/B09D3M3VZR"">Samsung Memorie EVO Plus Scheda SD da 64 GB, UHS-I U1, fino a 130 MB/s (MB-SC64K/EU)</a>"
"€0,172",€172,€22,128 GB,,SD,Flash,New,SanDisk 128GB Extreme scheda SDHC + RescuePro Deluxe fino a 180 MB/s UHS-I Class 10 U3 V30,"<a href=""https://www.amazon.it/dp/B09X7DZ9LG"">SanDisk 128GB Extreme scheda SDHC + RescuePro Deluxe fino a 180 MB/s UHS-I Class 10 U3 V30</a>","<a href=""https://www.amazon.it/dp/B09X7DZ9LG"">SanDisk 128GB Extreme scheda SDHC + RescuePro Deluxe fino a 180 MB/s UHS-I Class 10 U3 V30</a>"
"€0,173",€173,€22,128 GB,,External,SSD,New,"SSK SSD USB 3.2 Gen2 da 128 GB, lettura fino a 550 MB/s e scrittura da 500 MB/s SSD esterno portatile Unità USB veloce + adattatore USB C per smartphone, laptop, tablet e altro di tipo C","<a href=""https://www.amazon.it/dp/B0BS6QNYYG"">SSK SSD USB 3.2 Gen2 da 128 GB, lettura fino a 550 MB/s e scrittura da 500 MB/s SSD esterno portatile Unità USB veloce + adattatore USB C per smartphone, laptop, tablet e altro di tipo C</a>"
"€0,173",€173,€11,64 GB,,microSD,Flash,Used,Samsung Scheda di memoria microSD Evo Plus 64 GB SDXC U1 classe 10 A1 130 MB/s con adattatore versione 2021 (MB-MC64KA/EU),"<a href=""https://www.amazon.it/dp/B09R4HCKQ1"">Samsung Scheda di memoria microSD Evo Plus 64 GB SDXC U1 classe 10 A1 130 MB/s con adattatore versione 2021 (MB-MC64KA/EU)</a>","<a href=""https://www.amazon.it/dp/B09R4HCKQ1"">Samsung Scheda di memoria microSD Evo Plus 64 GB SDXC U1 classe 10 A1 130 MB/s con adattatore versione 2021 (MB-MC64KA/EU)</a>"
"€0,176",€176,€45,256 GB,,SD,Flash,New,"Gigastone Scheda di memoria SDXC da 256 GB, 4 K Fotocamera Pro Seriale, Compatibile con fotocamera Canon Nikon Sony Videocamera, A1 V30 UHS-I Classe 10","<a href=""https://www.amazon.it/dp/B093BRY83H"">Gigastone Scheda di memoria SDXC da 256 GB, 4 K Fotocamera Pro Seriale, Compatibile con fotocamera Canon Nikon Sony Videocamera, A1 V30 UHS-I Classe 10</a>"
"€0,177",€177,€11,64 GB,20 years,microSD,Flash,New,"SanDisk 64GB Extreme Go scheda microSDXC + adattatore SD (per smartphones e Tablet Android, Action Cam, Drones, UHS-I, fino a 200 MB/s, 5K, 4K, UHD, V30, Rescue PRO Deluxe, Class 10, U3) per Amazon","<a href=""https://www.amazon.it/dp/B0DCW9LSYJ"">SanDisk 64GB Extreme Go scheda microSDXC + adattatore SD (per smartphones e Tablet Android, Action Cam, Drones, UHS-I, fino a 200 MB/s, 5K, 4K, UHD, V30, Rescue PRO Deluxe, Class 10, U3) per Amazon</a>"
"€0,180",€180,€23,128 GB,10 years,microSD,Flash,New,"Samsung Memorie MB-MY128SA PRO Ultimate Scheda MicroSD da 128GB, UHS-I U3, Fino a 200 MB/s","<a href=""https://www.amazon.it/dp/B0CBMGDBTH"">Samsung Memorie MB-MY128SA PRO Ultimate Scheda MicroSD da 128GB, UHS-I U3, Fino a 200 MB/s</a>"
"€0,180",€180,€90,500 GB,,External,SSD,New,"Samsung T7 Portable SSD - 500 GB - USB 3.2 Gen.2 External SSD - Metallic Red (MU-PC500R/WW), Unità a stato solido","<a href=""https://www.amazon.it/dp/B087DF38J9"">Samsung T7 Portable SSD - 500 GB - USB 3.2 Gen.2 External SSD - Metallic Red (MU-PC500R/WW), Unità a stato solido</a>"
"€0,184",€184,€47,256 GB,,SD,Flash,New,LEXAR - Scheda SDXC 256Go 633X Uhs-I,"<a href=""https://www.amazon.it/dp/B082T3GN34"">LEXAR - Scheda SDXC 256Go 633X Uhs-I</a>"
"€0,187",€187,€6,32 GB,5 years,microSD,Flash,New,"Transcend TS32GUSD300S-AE Scheda di Memoria MicroSDXC 300S, 32 GB, Con adattatore, Imballaggio Apertura Facile","<a href=""https://www.amazon.it/dp/B07DVGCQP1"">Transcend TS32GUSD300S-AE Scheda di Memoria MicroSDXC 300S, 32 GB, Con adattatore, Imballaggio Apertura Facile</a>"
"€0,187",€187,€12,64 GB,,microSD,Flash,New,Samsung Scheda di memoria microSD Evo Plus 64 GB SDXC U1 classe 10 A1 130 MB/s con adattatore versione 2021 (MB-MC64KA/EU),"<a href=""https://www.amazon.it/dp/B09R4HCKQ1"">Samsung Scheda di memoria microSD Evo Plus 64 GB SDXC U1 classe 10 A1 130 MB/s con adattatore versione 2021 (MB-MC64KA/EU)</a>","<a href=""https://www.amazon.it/dp/B09R4HCKQ1"">Samsung Scheda di memoria microSD Evo Plus 64 GB SDXC U1 classe 10 A1 130 MB/s con adattatore versione 2021 (MB-MC64KA/EU)</a>"
"€0,188",€188,€12,64 GB,10 years,SD,Flash,New,"Samsung Memorie PRO Plus Scheda SD da 64 GB, UHS-I U3, Fino a 180 MB/s (MB-SD64S/EU)","<a href=""https://www.amazon.it/dp/B0BYPCQ5QR"">Samsung Memorie PRO Plus Scheda SD da 64 GB, UHS-I U3, Fino a 180 MB/s (MB-SD64S/EU)</a>"
"€0,189",€189,€24,128 GB,,USB,Flash,New,Nedis Unità flash - 128 GB - USB-A/USB-C - Velocità di lettura: 110 MB/s - Velocità di scrittura: 30 MB/s,"<a href=""https://www.amazon.it/dp/B0D2XBJ7VC"">Nedis Unità flash - 128 GB - USB-A/USB-C - Velocità di lettura: 110 MB/s - Velocità di scrittura: 30 MB/s</a>"
"€0,190",€190,€95,500 GB,2 years,External,SSD,New,"LaCie Portable SSD, 500GB, SSD esterno, USB-C, Compatibile con Iphone 15 Pro, USB 3.2 Gen 2, velocità fino a 1.050 MB/s, argento lunare, per Mac, PC e iPad, con servizi Rescue Services (STKS500400)","<a href=""https://www.amazon.it/dp/B092R9RQJR"">LaCie Portable SSD, 500GB, SSD esterno, USB-C, Compatibile con Iphone 15 Pro, USB 3.2 Gen 2, velocità fino a 1.050 MB/s, argento lunare, per Mac, PC e iPad, con servizi Rescue Services (STKS500400)</a>"
"€0,194",€194,€47,240 GB,2 years,External,SSD,New,Verbatim SSD Vx500 - 240 GB - Space Gray - 29 g - SSD esterno - SSD USB 3.0 - SSD esterno leggero - per Windows e Mac OS X - unità portatile - USB-C - memoria flash ad alta velocità,"<a href=""https://www.amazon.it/dp/B079S1X18X"">Verbatim SSD Vx500 - 240 GB - Space Gray - 29 g - SSD esterno - SSD USB 3.0 - SSD esterno leggero - per Windows e Mac OS X - unità portatile - USB-C - memoria flash ad alta velocità</a>"
"€0,195",€195,€25,128 GB,,microSD,Flash,New,"[5 Anni Recupero Dati Gratuito] GIGASTONE Scheda di Memoria 128 GB, 4K Camera Pro, Velocità fino a 100 MB/s, per GoPro, DJI, Drone, 4K Video A2 V30 U3 MicroSDXC con Adattatore","<a href=""https://www.amazon.it/dp/B07LBSBX5L"">[5 Anni Recupero Dati Gratuito] GIGASTONE Scheda di Memoria 128 GB, 4K Camera Pro, Velocità fino a 100 MB/s, per GoPro, DJI, Drone, 4K Video A2 V30 U3 MicroSDXC con Adattatore</a>"
"€0,195",€195,€25,128 GB,,SD,Flash,New,SanDisk 128GB Extreme PRO scheda SDXC + RescuePro Deluxe fino a 200 MB/s UHS-I Class 10 U3 V30,"<a href=""https://www.amazon.it/dp/B09X7FXHVJ"">SanDisk 128GB Extreme PRO scheda SDXC + RescuePro Deluxe fino a 200 MB/s UHS-I Class 10 U3 V30</a>","<a href=""https://www.amazon.it/dp/B09X7FXHVJ"">SanDisk 128GB Extreme PRO scheda SDXC + RescuePro Deluxe fino a 200 MB/s UHS-I Class 10 U3 V30</a>"
"€0,198",€198,€25,128 GB,,SD,Flash,New,Integral Scheda SD da 128 GB Scheda di memoria SD 4K Ultra HD Video Premium ad alta velocità SDXC fino a 100 MB/s SDXC V30 UHS-I U3 Classe 10,"<a href=""https://www.amazon.it/dp/B07FB7NL54"">Integral Scheda SD da 128 GB Scheda di memoria SD 4K Ultra HD Video Premium ad alta velocità SDXC fino a 100 MB/s SDXC V30 UHS-I U3 Classe 10</a>"
