Price per GB,Price per TB,Price,Capacity,Warranty,Form Factor,Technology,Condition,Affiliate Link,Affiliate Link HTML
"€0,011","€11,50",€115,10 TB,,"Internal 3.5""",HDD,Used,"Seagate Enterprise Capacity v6 10TB disco rigido interno ST10000NM0046 SATA 3.5"" HDD 256MB Cache","<a href=""https://www.amazon.it/dp/B0CW6K8DZ3"">Seagate Enterprise Capacity v6 10TB disco rigido interno ST10000NM0046 SATA 3.5"" HDD 256MB Cache</a>"
"€0,012","€11,78",€165,14 TB,,"Internal 3.5""",HDD,Used,"ST14000NM001G - Disco rigido 3,5"", SATA 6Gb/s, 14TB, 7200RPM, 512e/4Kn, per applicazioni aziendali","<a href=""https://www.amazon.it/dp/B084Z4LGN7"">ST14000NM001G - Disco rigido 3,5"", SATA 6Gb/s, 14TB, 7200RPM, 512e/4Kn, per applicazioni aziendali</a>","<a href=""https://www.amazon.it/dp/B084Z4LGN7"">ST14000NM001G - Disco rigido 3,5"", SATA 6Gb/s, 14TB, 7200RPM, 512e/4Kn, per applicazioni aziendali</a>"
"€0,012","€11,78",€165,14 TB,,"Internal 3.5""",HDD,Used,"Seagate Exos X16 ST14000NM001G 14TB Interne Server Festplatte 3,5 Zoll HDD SATA 6Gb/s 7200RPM 256MB Cache (Ricondizionato)","<a href=""https://www.amazon.it/dp/B0D6BR9HLV"">Seagate Exos X16 ST14000NM001G 14TB Interne Server Festplatte 3,5 Zoll HDD SATA 6Gb/s 7200RPM 256MB Cache (Ricondizionato)</a>"
"€0,012","€12,08",€145,12 TB,,"Internal 3.5""",HDD,Used,"Seagate Enterprise Capacity v7 ST12000NM0127 - Disco rigido - 12 TB - interno - 3.5"" - SATA 6Gb/s - 7200 RPM - 256MB Cache","<a href=""https://www.amazon.it/dp/B0CFBF7SV8"">Seagate Enterprise Capacity v7 ST12000NM0127 - Disco rigido - 12 TB - interno - 3.5"" - SATA 6Gb/s - 7200 RPM - 256MB Cache</a>"
"€0,012","€12,49",€150,12 TB,,"Internal 3.5""",HDD,Used,"Seagate IronWolf - Disco rigido interno da 12 TB, 3,5"", 7200 giri/min, per sistemi NAS da 1-8 alloggiamenti (256 MB di cache, velocità di carico di lavoro 180 TB/anno, fino a 210 MB/s)","<a href=""https://www.amazon.it/dp/B084WLXWXD"">Seagate IronWolf - Disco rigido interno da 12 TB, 3,5"", 7200 giri/min, per sistemi NAS da 1-8 alloggiamenti (256 MB di cache, velocità di carico di lavoro 180 TB/anno, fino a 210 MB/s)</a>"
"€0,012","€12,49",€150,12 TB,,"Internal 3.5""",HDD,Used,"Seagate IronWolf 12TB ST12000VN0007 Interne NAS Festplatte 3,5 Zoll HDD SATA3, 7200RPM, 256MB Cache (Ricondizionato)","<a href=""https://www.amazon.it/dp/B07KR8ZL5H"">Seagate IronWolf 12TB ST12000VN0007 Interne NAS Festplatte 3,5 Zoll HDD SATA3, 7200RPM, 256MB Cache (Ricondizionato)</a>"
"€0,012","€12,49",€150,12 TB,,"Internal 3.5""",HDD,Used,"Seagate Skyhawk Surveillance 12TB disco rigido interno ST12000VX0007 3.5"" HDD SATA3 7200RPM 256MB Cache (Ricondizionato)","<a href=""https://www.amazon.it/dp/B0DFWPCT1K"">Seagate Skyhawk Surveillance 12TB disco rigido interno ST12000VX0007 3.5"" HDD SATA3 7200RPM 256MB Cache (Ricondizionato)</a>"
"€0,012","€12,50",€200,16 TB,,"Internal 3.5""",HDD,Used,"Seagate Exos X18 Enterprise HDD, CMR 3,5"", Hyperscale SATA 6GB/s, 7.200 giri/min, 512e, 4Kn FastFormat, bassa latenza con cache migliorata, modello ST16000NM000J (ricondizionato)","<a href=""https://www.amazon.it/dp/B0CF5XVHMS"">Seagate Exos X18 Enterprise HDD, CMR 3,5"", Hyperscale SATA 6GB/s, 7.200 giri/min, 512e, 4Kn FastFormat, bassa latenza con cache migliorata, modello ST16000NM000J (ricondizionato)</a>"
"€0,012","€12,50",€200,16 TB,5 years,Internal,SAS,Used,"Seagate Exos X18, 16TB, Hard Disk Interno, HDD, SAS, Classe Enterprise, CMR 3,5"", Hyperscale SATA 6GB/s, 7.200 RPM, 512e, caching avanzato (ST16000NM000J)","<a href=""https://www.amazon.it/dp/B08JV7N6J1"">Seagate Exos X18, 16TB, Hard Disk Interno, HDD, SAS, Classe Enterprise, CMR 3,5"", Hyperscale SATA 6GB/s, 7.200 RPM, 512e, caching avanzato (ST16000NM000J)</a>","<a href=""https://www.amazon.it/dp/B08JV7N6J1"">Seagate Exos X18, 16TB, Hard Disk Interno, HDD, SAS, Classe Enterprise, CMR 3,5"", Hyperscale SATA 6GB/s, 7.200 RPM, 512e, caching avanzato (ST16000NM000J)</a>"
"€0,013","€13,24",€159,12 TB,,"Internal 3.5""",HDD,Used,"Seagate Barracuda Pro ST12000DM0007 - Disco rigido interno da 12 TB – 3,5 pollici SATA 6 Gb/s, 7200 giri/min, 256 MB di cache per computer desktop (rinnovato)","<a href=""https://www.amazon.it/dp/B082YJHBHC"">Seagate Barracuda Pro ST12000DM0007 - Disco rigido interno da 12 TB – 3,5 pollici SATA 6 Gb/s, 7200 giri/min, 256 MB di cache per computer desktop (rinnovato)</a>"
"€0,015","€14,70",€44,3 TB,,"Internal 3.5""",HDD,New,"Sonnics Disco rigido SATA da 3,5 pollici, 7200 giri/min, per PC desktop, sistema di sorveglianza, telecamera CCTV DVR (3TB)","<a href=""https://www.amazon.it/dp/B0BLD3PGXB"">Sonnics Disco rigido SATA da 3,5 pollici, 7200 giri/min, per PC desktop, sistema di sorveglianza, telecamera CCTV DVR (3TB)</a>"
"€0,015","€14,86",€119,8 TB,5 years,"Internal 3.5""",HDD,Used,"Seagate BarraCuda, 8 TB, Hard Disk Interno, SATA da 6 GBit/s, 3,5"", 5.400 RPM, Cache da 256 MB per PC Desktop (ST8000DM004)","<a href=""https://www.amazon.it/dp/B075WYBQXJ"">Seagate BarraCuda, 8 TB, Hard Disk Interno, SATA da 6 GBit/s, 3,5"", 5.400 RPM, Cache da 256 MB per PC Desktop (ST8000DM004)</a>","<a href=""https://www.amazon.it/dp/B075WYBQXJ"">Seagate BarraCuda, 8 TB, Hard Disk Interno, SATA da 6 GBit/s, 3,5"", 5.400 RPM, Cache da 256 MB per PC Desktop (ST8000DM004)</a>"
"€0,016","€15,71",€283,18 TB,,"Internal 3.5""",HDD,Used,"Seagate Exos X18, 18TB, Hard Disk Interno, HDD, SAS, Classe Enterprise, CMR 3,5"", Hyperscale SATA 6GB/s, 7.200 RPM, 512e, caching avanzato (ST18000NM000J)","<a href=""https://www.amazon.it/dp/B08JV6PP9B"">Seagate Exos X18, 18TB, Hard Disk Interno, HDD, SAS, Classe Enterprise, CMR 3,5"", Hyperscale SATA 6GB/s, 7.200 RPM, 512e, caching avanzato (ST18000NM000J)</a>","<a href=""https://www.amazon.it/dp/B08JV6PP9B"">Seagate Exos X18, 18TB, Hard Disk Interno, HDD, SAS, Classe Enterprise, CMR 3,5"", Hyperscale SATA 6GB/s, 7.200 RPM, 512e, caching avanzato (ST18000NM000J)</a>"
"€0,016","€15,81",€253,16 TB,,"Internal 3.5""",HDD,Used,"SEAGATE Exos X16 ST16000NM001G - Hard disk interno da 16 TB, SATA 6Gb/s, 7200 giri/min, memoria buffer: 256 MB","<a href=""https://www.amazon.it/dp/B07XM9RM95"">SEAGATE Exos X16 ST16000NM001G - Hard disk interno da 16 TB, SATA 6Gb/s, 7200 giri/min, memoria buffer: 256 MB</a>"
"€0,017","€16,67",€200,12 TB,2 years,"Internal 3.5""",HDD,Used,SEAGATE SURVEILLANCE AI SKYHAWK 12TB HDD SATA 6GB/S 256MB CACHE 8.9CM 3.5INCH,"<a href=""https://www.amazon.it/dp/B09DDJ2LZK"">SEAGATE SURVEILLANCE AI SKYHAWK 12TB HDD SATA 6GB/S 256MB CACHE 8.9CM 3.5INCH</a>","<a href=""https://www.amazon.it/dp/B09DDJ2LZK"">SEAGATE SURVEILLANCE AI SKYHAWK 12TB HDD SATA 6GB/S 256MB CACHE 8.9CM 3.5INCH</a>"
"€0,017","€16,67",€100,6 TB,,"Internal 3.5""",HDD,Used,"Seagate ST6000NM0024 Enterprise Capacity Hard Disk, 6000 GB HDA, Nero","<a href=""https://www.amazon.it/dp/B00J6ONE7W"">Seagate ST6000NM0024 Enterprise Capacity Hard Disk, 6000 GB HDA, Nero</a>"
"€0,017","€16,67",€100,6 TB,,"Internal 3.5""",HDD,Used,"Seagate ST6000NM0024 - Disco rigido interno 3,5"" da 6 TB","<a href=""https://www.amazon.it/dp/B00JJIE8E8"">Seagate ST6000NM0024 - Disco rigido interno 3,5"" da 6 TB</a>","<a href=""https://www.amazon.it/dp/B00JJIE8E8"">Seagate ST6000NM0024 - Disco rigido interno 3,5"" da 6 TB</a>"
"€0,017","€16,74",€268,16 TB,5 years,Internal,SAS,Used,"Seagate Exos X16, 16TB, Hard Disk Interno, SATA, Classe Enterprise, 3,5"", Data Center (ST16000NM002G)","<a href=""https://www.amazon.it/dp/B07TBG66PY"">Seagate Exos X16, 16TB, Hard Disk Interno, SATA, Classe Enterprise, 3,5"", Data Center (ST16000NM002G)</a>","<a href=""https://www.amazon.it/dp/B07TBG66PY"">Seagate Exos X16, 16TB, Hard Disk Interno, SATA, Classe Enterprise, 3,5"", Data Center (ST16000NM002G)</a>"
"€0,017","€16,88",€270,16 TB,5 years,Internal,SAS,New,"Seagate Exos X18, 16TB, Hard Disk Interno, HDD, SAS, Classe Enterprise, CMR 3,5"", Hyperscale SATA 6GB/s, 7.200 RPM, 512e, caching avanzato (ST16000NM000J)","<a href=""https://www.amazon.it/dp/B08JV7N6J1"">Seagate Exos X18, 16TB, Hard Disk Interno, HDD, SAS, Classe Enterprise, CMR 3,5"", Hyperscale SATA 6GB/s, 7.200 RPM, 512e, caching avanzato (ST16000NM000J)</a>","<a href=""https://www.amazon.it/dp/B08JV7N6J1"">Seagate Exos X18, 16TB, Hard Disk Interno, HDD, SAS, Classe Enterprise, CMR 3,5"", Hyperscale SATA 6GB/s, 7.200 RPM, 512e, caching avanzato (ST16000NM000J)</a>"
"€0,017","€16,90",€338,20 TB,,Internal,SAS,Used,"Seagate Exos X20 20TB, disco rigido SAS 12Gb/s da 3,5 pollici, 7200 RPM, 2,5M MTBF, 512e e 4Kn FastFormat, bassa latenza con cache avanzata (ST20000NM002D)","<a href=""https://www.amazon.it/dp/B09MWKN3RN"">Seagate Exos X20 20TB, disco rigido SAS 12Gb/s da 3,5 pollici, 7200 RPM, 2,5M MTBF, 512e e 4Kn FastFormat, bassa latenza con cache avanzata (ST20000NM002D)</a>","<a href=""https://www.amazon.it/dp/B09MWKN3RN"">Seagate Exos X20 20TB, disco rigido SAS 12Gb/s da 3,5 pollici, 7200 RPM, 2,5M MTBF, 512e e 4Kn FastFormat, bassa latenza con cache avanzata (ST20000NM002D)</a>"
"€0,017","€17,14",€240,14 TB,,"Internal 3.5""",HDD,New,"ST14000NM001G - Disco rigido 3,5"", SATA 6Gb/s, 14TB, 7200RPM, 512e/4Kn, per applicazioni aziendali","<a href=""https://www.amazon.it/dp/B084Z4LGN7"">ST14000NM001G - Disco rigido 3,5"", SATA 6Gb/s, 14TB, 7200RPM, 512e/4Kn, per applicazioni aziendali</a>","<a href=""https://www.amazon.it/dp/B084Z4LGN7"">ST14000NM001G - Disco rigido 3,5"", SATA 6Gb/s, 14TB, 7200RPM, 512e/4Kn, per applicazioni aziendali</a>"
"€0,017","€17,15",€343,20 TB,,"Internal 3.5""",HDD,New,"Seagate Exos X20, 20TB, 3,5 pollici SATA 6Gb/s, 7200 RPM, 2,5M MTBF, 512e e 4Kn FastFormat, disco rigido a bassa latenza con cache avanzata (ST20000NM007D)","<a href=""https://www.amazon.it/dp/B09MWJHDNC"">Seagate Exos X20, 20TB, 3,5 pollici SATA 6Gb/s, 7200 RPM, 2,5M MTBF, 512e e 4Kn FastFormat, disco rigido a bassa latenza con cache avanzata (ST20000NM007D)</a>","<a href=""https://www.amazon.it/dp/B09MWJHDNC"">Seagate Exos X20, 20TB, 3,5 pollici SATA 6Gb/s, 7200 RPM, 2,5M MTBF, 512e e 4Kn FastFormat, disco rigido a bassa latenza con cache avanzata (ST20000NM007D)</a>"
"€0,017","€17,23",€345,20 TB,,"Internal 3.5""",HDD,Used,"Seagate Exos X20, 20TB, 3,5 pollici SATA 6Gb/s, 7200 RPM, 2,5M MTBF, 512e e 4Kn FastFormat, disco rigido a bassa latenza con cache avanzata (ST20000NM007D)","<a href=""https://www.amazon.it/dp/B09MWJHDNC"">Seagate Exos X20, 20TB, 3,5 pollici SATA 6Gb/s, 7200 RPM, 2,5M MTBF, 512e e 4Kn FastFormat, disco rigido a bassa latenza con cache avanzata (ST20000NM007D)</a>","<a href=""https://www.amazon.it/dp/B09MWJHDNC"">Seagate Exos X20, 20TB, 3,5 pollici SATA 6Gb/s, 7200 RPM, 2,5M MTBF, 512e e 4Kn FastFormat, disco rigido a bassa latenza con cache avanzata (ST20000NM007D)</a>"
"€0,017","€17,25",€138,8 TB,5 years,"Internal 3.5""",HDD,New,"Seagate BarraCuda, 8 TB, Hard Disk Interno, SATA da 6 GBit/s, 3,5"", 5.400 RPM, Cache da 256 MB per PC Desktop (ST8000DM004)","<a href=""https://www.amazon.it/dp/B075WYBQXJ"">Seagate BarraCuda, 8 TB, Hard Disk Interno, SATA da 6 GBit/s, 3,5"", 5.400 RPM, Cache da 256 MB per PC Desktop (ST8000DM004)</a>","<a href=""https://www.amazon.it/dp/B075WYBQXJ"">Seagate BarraCuda, 8 TB, Hard Disk Interno, SATA da 6 GBit/s, 3,5"", 5.400 RPM, Cache da 256 MB per PC Desktop (ST8000DM004)</a>"
"€0,017","€17,50",€105,6 TB,,"Internal 3.5""",HDD,New,"Seagate ST6000NM0024 - Disco rigido interno 3,5"" da 6 TB","<a href=""https://www.amazon.it/dp/B00JJIE8E8"">Seagate ST6000NM0024 - Disco rigido interno 3,5"" da 6 TB</a>","<a href=""https://www.amazon.it/dp/B00JJIE8E8"">Seagate ST6000NM0024 - Disco rigido interno 3,5"" da 6 TB</a>"
"€0,018","€17,70",€425,24 TB,,"Internal 3.5""",HDD,Used,"Seagate Exos X24 - Disco rigido interno 24TB ST24000NM000C 3,5"" HDD SATA3 512MB 7200RPM (Ricondizionato)","<a href=""https://www.amazon.it/dp/B0DFCTBDRQ"">Seagate Exos X24 - Disco rigido interno 24TB ST24000NM000C 3,5"" HDD SATA3 512MB 7200RPM (Ricondizionato)</a>"
"€0,018","€17,87",€322,18 TB,2 years,Internal,SAS,New,"Toshiba 18TB Enterprise Internal Hard Drive – MG Series 3.5' SATA HDD Mainstream server and storage, 24/7 Reliable Operation, Hyperscale and cloud storage (MG08ACA16TE)","<a href=""https://www.amazon.it/dp/B093Z5LFWD"">Toshiba 18TB Enterprise Internal Hard Drive – MG Series 3.5' SATA HDD Mainstream server and storage, 24/7 Reliable Operation, Hyperscale and cloud storage (MG08ACA16TE)</a>"
"€0,018","€17,96",€180,10 TB,2 years,"External 3.5""",HDD,New,"UnionSine Hard Disk Esterno 3,5"" 10TB USB 3.2Gen2 Type-C HDD Storage per PC, Mac, Desktop, Laptop, MacBook,TV-HD3510","<a href=""https://www.amazon.it/dp/B0B7RRQGFQ"">UnionSine Hard Disk Esterno 3,5"" 10TB USB 3.2Gen2 Type-C HDD Storage per PC, Mac, Desktop, Laptop, MacBook,TV-HD3510</a>"
"€0,018","€17,98",€396,22 TB,,"Internal 3.5""",HDD,New,"Toshiba Disco rigido interno Enterprise da 22 TB – HDD SATA da 3,5"" serie MG per server, storage, funzionamento 24/7, Hyperscale, Cloud (MG10AFA22TE)","<a href=""https://www.amazon.it/dp/B0CN5LBWRD"">Toshiba Disco rigido interno Enterprise da 22 TB – HDD SATA da 3,5"" serie MG per server, storage, funzionamento 24/7, Hyperscale, Cloud (MG10AFA22TE)</a>"
"€0,018","€18,36",€147,8 TB,,"Internal 3.5""",HDD,Used,"Seagate IronWolf, 8TB, Hard Disk SATA da 6GBit/s, HDD, CMR 3,5"" 7.200 RPM, Cache da 256 MB per NAS con Sistema RAID, 3 anni Rescue Services (ST8000VN004)","<a href=""https://www.amazon.it/dp/B07SZVVBBK"">Seagate IronWolf, 8TB, Hard Disk SATA da 6GBit/s, HDD, CMR 3,5"" 7.200 RPM, Cache da 256 MB per NAS con Sistema RAID, 3 anni Rescue Services (ST8000VN004)</a>","<a href=""https://www.amazon.it/dp/B07SZVVBBK"">Seagate IronWolf, 8TB, Hard Disk SATA da 6GBit/s, HDD, CMR 3,5"" 7.200 RPM, Cache da 256 MB per NAS con Sistema RAID, 3 anni Rescue Services (ST8000VN004)</a>"
"€0,018","€18,48",€74,4 TB,,"Internal 3.5""",HDD,Used,"Seagate IronWolf PRO - Disco rigido interno NAS ST4000NE001 3,5"" HDD SATA3","<a href=""https://www.amazon.it/dp/B0CRBJK29D"">Seagate IronWolf PRO - Disco rigido interno NAS ST4000NE001 3,5"" HDD SATA3</a>"
"€0,018","€18,48",€74,4 TB,,"Internal 3.5""",HDD,Used,"Seagate IronWolf Pro, 4TB, NAS, Hard Disk interno, HDD, CMR 3,5"" SATA 6 GB/s, cache 256 MB, archiviazione RAID (ST4000NE001) (ricondizionato)","<a href=""https://www.amazon.it/dp/B092MP3CDM"">Seagate IronWolf Pro, 4TB, NAS, Hard Disk interno, HDD, CMR 3,5"" SATA 6 GB/s, cache 256 MB, archiviazione RAID (ST4000NE001) (ricondizionato)</a>"
"€0,018","€18,48",€74,4 TB,,"Internal 3.5""",HDD,Used,Seagate IronWolf Pro 4TB NAS Internal Hard Drive HDD – 3.5 pollici SATA 6Gb/s 7200 RPM 128 MB Cache per RAID Network Attached Storage Data Recovery Service – Frustration Free Packaging (ST4000NE001),"<a href=""https://www.amazon.it/dp/B084ZV8YW8"">Seagate IronWolf Pro 4TB NAS Internal Hard Drive HDD – 3.5 pollici SATA 6Gb/s 7200 RPM 128 MB Cache per RAID Network Attached Storage Data Recovery Service – Frustration Free Packaging (ST4000NE001)</a>","<a href=""https://www.amazon.it/dp/B084ZV8YW8"">Seagate IronWolf Pro 4TB NAS Internal Hard Drive HDD – 3.5 pollici SATA 6Gb/s 7200 RPM 128 MB Cache per RAID Network Attached Storage Data Recovery Service – Frustration Free Packaging (ST4000NE001)</a>"
"€0,019","€18,75",€300,16 TB,5 years,Internal,SAS,New,"Seagate Exos X16, 16TB, Hard Disk Interno, SATA, Classe Enterprise, 3,5"", Data Center (ST16000NM002G)","<a href=""https://www.amazon.it/dp/B07TBG66PY"">Seagate Exos X16, 16TB, Hard Disk Interno, SATA, Classe Enterprise, 3,5"", Data Center (ST16000NM002G)</a>","<a href=""https://www.amazon.it/dp/B07TBG66PY"">Seagate Exos X16, 16TB, Hard Disk Interno, SATA, Classe Enterprise, 3,5"", Data Center (ST16000NM002G)</a>"
"€0,019","€19,07",€153,8 TB,,"External 3.5""",HDD,Used,"Seagate One Touch Hub, 8TB, Unità Disco Esterna per Desktop, USB-C, USB 3.0, per PC Desktop, PC Portatili e Mac, 2 Anni di Servizi Rescue (STLC8000400)","<a href=""https://www.amazon.it/dp/B093WZHS1G"">Seagate One Touch Hub, 8TB, Unità Disco Esterna per Desktop, USB-C, USB 3.0, per PC Desktop, PC Portatili e Mac, 2 Anni di Servizi Rescue (STLC8000400)</a>","<a href=""https://www.amazon.it/dp/B093WZHS1G"">Seagate One Touch Hub, 8TB, Unità Disco Esterna per Desktop, USB-C, USB 3.0, per PC Desktop, PC Portatili e Mac, 2 Anni di Servizi Rescue (STLC8000400)</a>"
"€0,020","€19,67",€354,18 TB,,"Internal 3.5""",HDD,New,"Seagate Exos X18, 18TB, Hard Disk Interno, HDD, SAS, Classe Enterprise, CMR 3,5"", Hyperscale SATA 6GB/s, 7.200 RPM, 512e, caching avanzato (ST18000NM000J)","<a href=""https://www.amazon.it/dp/B08JV6PP9B"">Seagate Exos X18, 18TB, Hard Disk Interno, HDD, SAS, Classe Enterprise, CMR 3,5"", Hyperscale SATA 6GB/s, 7.200 RPM, 512e, caching avanzato (ST18000NM000J)</a>","<a href=""https://www.amazon.it/dp/B08JV6PP9B"">Seagate Exos X18, 18TB, Hard Disk Interno, HDD, SAS, Classe Enterprise, CMR 3,5"", Hyperscale SATA 6GB/s, 7.200 RPM, 512e, caching avanzato (ST18000NM000J)</a>"
"€0,020","€19,98",€120,6 TB,,Internal,SAS,Used,"Seagate Exos X16, 6TB, Hard Disk Interno, SAS, Classe Enterprise, 3,5"", Data Center (ST6000NM0095)","<a href=""https://www.amazon.it/dp/B01CG0DBXE"">Seagate Exos X16, 6TB, Hard Disk Interno, SAS, Classe Enterprise, 3,5"", Data Center (ST6000NM0095)</a>","<a href=""https://www.amazon.it/dp/B01CG0DBXE"">Seagate Exos X16, 6TB, Hard Disk Interno, SAS, Classe Enterprise, 3,5"", Data Center (ST6000NM0095)</a>"
"€0,021","€20,75",€83,4 TB,2 years,"Internal 3.5""",HDD,New,"Seagate Surveillance HDD Skyhawk 3.5"" 4000 GB Serial ATA III","<a href=""https://www.amazon.it/dp/B08TV9TFPB"">Seagate Surveillance HDD Skyhawk 3.5"" 4000 GB Serial ATA III</a>"
"€0,021","€20,81",€166,8 TB,,"External 3.5""",HDD,New,"Seagate One Touch Hub, 8TB, Unità Disco Esterna per Desktop, USB-C, USB 3.0, per PC Desktop, PC Portatili e Mac, 2 Anni di Servizi Rescue (STLC8000400)","<a href=""https://www.amazon.it/dp/B093WZHS1G"">Seagate One Touch Hub, 8TB, Unità Disco Esterna per Desktop, USB-C, USB 3.0, per PC Desktop, PC Portatili e Mac, 2 Anni di Servizi Rescue (STLC8000400)</a>","<a href=""https://www.amazon.it/dp/B093WZHS1G"">Seagate One Touch Hub, 8TB, Unità Disco Esterna per Desktop, USB-C, USB 3.0, per PC Desktop, PC Portatili e Mac, 2 Anni di Servizi Rescue (STLC8000400)</a>"
"€0,021","€20,98",€84,4 TB,,"Internal 3.5""",HDD,New,TOSHIBA EUROPE P300 4TB SATA 5400 RPM 3.5inch Bulk Desktop PC HDD,"<a href=""https://www.amazon.it/dp/B081K7V56W"">TOSHIBA EUROPE P300 4TB SATA 5400 RPM 3.5inch Bulk Desktop PC HDD</a>"
"€0,021","€21,25",€170,8 TB,,"Internal 3.5""",HDD,Used,Western Digital 8 TB nero 256 MB INT,"<a href=""https://www.amazon.it/dp/B08GTXJ3LS"">Western Digital 8 TB nero 256 MB INT</a>"
"€0,021","€21,50",€129,6 TB,,"External 3.5""",HDD,New,"Intenso Unità di memoria HDD da 3,5"" per desktop 3,5"" da 6 TB","<a href=""https://www.amazon.it/dp/B0716RRWTQ"">Intenso Unità di memoria HDD da 3,5"" per desktop 3,5"" da 6 TB</a>"
"€0,022","€21,75",€87,4 TB,2 years,"Internal 3.5""",HDD,New,"Seagate SkyHawk, 4TB, Hard Disk Interno per Applicazioni Video, Unità SATA 6GBit/s, 3.5"", Cache 256 MB, 3 Anni servizi Rescue in-house (ST4000VX016)","<a href=""https://www.amazon.it/dp/B09YNN2PKG"">Seagate SkyHawk, 4TB, Hard Disk Interno per Applicazioni Video, Unità SATA 6GBit/s, 3.5"", Cache 256 MB, 3 Anni servizi Rescue in-house (ST4000VX016)</a>","<a href=""https://www.amazon.it/dp/B09YNN2PKG"">Seagate SkyHawk, 4TB, Hard Disk Interno per Applicazioni Video, Unità SATA 6GBit/s, 3.5"", Cache 256 MB, 3 Anni servizi Rescue in-house (ST4000VX016)</a>"
"€0,022","€22,00",€44,2 TB,,"Internal 3.5""",HDD,New,"Seagate Video 3.5 HDD ST2000VM003, 2 TB, Nero","<a href=""https://www.amazon.it/dp/B008B0RQ1C"">Seagate Video 3.5 HDD ST2000VM003, 2 TB, Nero</a>","<a href=""https://www.amazon.it/dp/B008B0RQ1C"">Seagate Video 3.5 HDD ST2000VM003, 2 TB, Nero</a>"
"€0,022","€22,00",€88,4 TB,,"Internal 3.5""",HDD,New,Seagate ST4000NM0035 HDD da 4 TB,"<a href=""https://www.amazon.it/dp/B01CG0DD1E"">Seagate ST4000NM0035 HDD da 4 TB</a>","<a href=""https://www.amazon.it/dp/B01CG0DD1E"">Seagate ST4000NM0035 HDD da 4 TB</a>"
"€0,022","€22,10",€442,20 TB,,Internal,SAS,New,"Seagate Exos X20 20TB, disco rigido SAS 12Gb/s da 3,5 pollici, 7200 RPM, 2,5M MTBF, 512e e 4Kn FastFormat, bassa latenza con cache avanzata (ST20000NM002D)","<a href=""https://www.amazon.it/dp/B09MWKN3RN"">Seagate Exos X20 20TB, disco rigido SAS 12Gb/s da 3,5 pollici, 7200 RPM, 2,5M MTBF, 512e e 4Kn FastFormat, bassa latenza con cache avanzata (ST20000NM002D)</a>","<a href=""https://www.amazon.it/dp/B09MWKN3RN"">Seagate Exos X20 20TB, disco rigido SAS 12Gb/s da 3,5 pollici, 7200 RPM, 2,5M MTBF, 512e e 4Kn FastFormat, bassa latenza con cache avanzata (ST20000NM002D)</a>"
"€0,022","€22,25",€89,4 TB,3 years,"Internal 3.5""",HDD,Used,"WD Red Plus 4TB per NAS Hard Disk interno da 3.5”, 5400 RPM Class, SATA 6 GB/s, CMR, Cache da 256 MB, Garanzia 3 anni","<a href=""https://www.amazon.it/dp/B0BDXSK2K7"">WD Red Plus 4TB per NAS Hard Disk interno da 3.5”, 5400 RPM Class, SATA 6 GB/s, CMR, Cache da 256 MB, Garanzia 3 anni</a>","<a href=""https://www.amazon.it/dp/B0BDXSK2K7"">WD Red Plus 4TB per NAS Hard Disk interno da 3.5”, 5400 RPM Class, SATA 6 GB/s, CMR, Cache da 256 MB, Garanzia 3 anni</a>"
"€0,022","€22,45",€45,2 TB,,"Internal 3.5""",HDD,New,"Toshiba MG04ACA200E disco rigido interno 3.5"" 2000 GB Serial ATA III","<a href=""https://www.amazon.it/dp/B00SUO65GG"">Toshiba MG04ACA200E disco rigido interno 3.5"" 2000 GB Serial ATA III</a>"
"€0,022","€22,48",€90,4 TB,,"Internal 3.5""",HDD,Used,"Seagate Barracuda ST4000LM024 - Hard disk interno da 4 TB, 2,5"" (ricondizionato certificato)","<a href=""https://www.amazon.it/dp/B07N8JY4VZ"">Seagate Barracuda ST4000LM024 - Hard disk interno da 4 TB, 2,5"" (ricondizionato certificato)</a>"
"€0,022","€22,49",€180,8 TB,,"Internal 3.5""",HDD,Used,"Seagate Disco rigido Ironwolf 3,5"" 8 TB SATA 6 GB/s","<a href=""https://www.amazon.it/dp/B0BNGLJMJ9"">Seagate Disco rigido Ironwolf 3,5"" 8 TB SATA 6 GB/s</a>","<a href=""https://www.amazon.it/dp/B0BNGLJMJ9"">Seagate Disco rigido Ironwolf 3,5"" 8 TB SATA 6 GB/s</a>"
"€0,022","€22,50",€45,2 TB,,"Internal 3.5""",HDD,Used,Seagate Desktop HDD ST2000DM001 - hard disk - 2 TB - SATA 6Gb/s (Ricondizionato Certificato),"<a href=""https://www.amazon.it/dp/B07NWXP5Y5"">Seagate Desktop HDD ST2000DM001 - hard disk - 2 TB - SATA 6Gb/s (Ricondizionato Certificato)</a>"
"€0,023","€22,58",€406,18 TB,5 years,"Internal 3.5""",HDD,New,"Seagate Exos X20, 18TB, 3,5 pollici SATA 6Gb/s, 7200 RPM, 2,5M MTBF, 512e e 4Kn FastFormat, disco rigido a bassa latenza con cache avanzata (ST18000NM003D)","<a href=""https://www.amazon.it/dp/B09MWLJ1P5"">Seagate Exos X20, 18TB, 3,5 pollici SATA 6Gb/s, 7200 RPM, 2,5M MTBF, 512e e 4Kn FastFormat, disco rigido a bassa latenza con cache avanzata (ST18000NM003D)</a>"
"€0,023","€22,64",€408,18 TB,,"Internal 3.5""",HDD,New,Seagate EXOS X18 18TB SATA SED 3.5 IN 7200RPM HELIUM 512E/4K,"<a href=""https://www.amazon.it/dp/B091KRTCTJ"">Seagate EXOS X18 18TB SATA SED 3.5 IN 7200RPM HELIUM 512E/4K</a>"
"€0,023","€22,97",€92,4 TB,,"Internal 3.5""",HDD,Used,Seagate ST4000NM0035 HDD da 4 TB,"<a href=""https://www.amazon.it/dp/B01CG0DD1E"">Seagate ST4000NM0035 HDD da 4 TB</a>","<a href=""https://www.amazon.it/dp/B01CG0DD1E"">Seagate ST4000NM0035 HDD da 4 TB</a>"
"€0,023","€23,00",€92,4 TB,2 years,"Internal 3.5""",HDD,New,"Seagate Barracuda ST4000DM004 4000GB Serial ATA III internal hard drive - internal hard drives 4000 GB, Serial ATA III, 3.5"", PC, HDD, 256 MB","<a href=""https://www.amazon.it/dp/B07115ZSQ6"">Seagate Barracuda ST4000DM004 4000GB Serial ATA III internal hard drive - internal hard drives 4000 GB, Serial ATA III, 3.5"", PC, HDD, 256 MB</a>","<a href=""https://www.amazon.it/dp/B07115ZSQ6"">Seagate Barracuda ST4000DM004 4000GB Serial ATA III internal hard drive - internal hard drives 4000 GB, Serial ATA III, 3.5"", PC, HDD, 256 MB</a>"
"€0,023","€23,48",€94,4 TB,,"Internal 3.5""",HDD,Used,"WD Red Plus 4 TB NAS 3,5"" Hard Disk Interno - Classe 5.400 RPM, SATA 6 Gb/s, CMR, cache 128 MB","<a href=""https://www.amazon.it/dp/B08VH8C3WZ"">WD Red Plus 4 TB NAS 3,5"" Hard Disk Interno - Classe 5.400 RPM, SATA 6 Gb/s, CMR, cache 128 MB</a>","<a href=""https://www.amazon.it/dp/B08VH8C3WZ"">WD Red Plus 4 TB NAS 3,5"" Hard Disk Interno - Classe 5.400 RPM, SATA 6 Gb/s, CMR, cache 128 MB</a>"
"€0,023","€23,48",€188,8 TB,2 years,"Internal 3.5""",HDD,New,"Seagate Surveillance HDD SkyHawk AI 3.5"" 8000 GB Serial ATA III","<a href=""https://www.amazon.it/dp/B08YKC5N52"">Seagate Surveillance HDD SkyHawk AI 3.5"" 8000 GB Serial ATA III</a>"
"€0,024","€23,52",€94,4 TB,,"External 3.5""",HDD,Used,"WD 4TB My Passport Ultra HDD portatile USB-C con software per gestione di dispositivi, backup e protezione tramite password - funziona con PC, Xbox X, Xbox S, PS4 and PS5 - Argento","<a href=""https://www.amazon.it/dp/B07GK2PC5V"">WD 4TB My Passport Ultra HDD portatile USB-C con software per gestione di dispositivi, backup e protezione tramite password - funziona con PC, Xbox X, Xbox S, PS4 and PS5 - Argento</a>","<a href=""https://www.amazon.it/dp/B07GK2PC5V"">WD 4TB My Passport Ultra HDD portatile USB-C con software per gestione di dispositivi, backup e protezione tramite password - funziona con PC, Xbox X, Xbox S, PS4 and PS5 - Argento</a>"
