Price per GB,Price per TB,Price,Capacity,Warranty,Form Factor,Technology,Condition,Affiliate Link,Affiliate Link HTML
"€0,038","€38,04",€76,2 TB,2 years,"External 2.5""",HDD,New,"WD 2 TB Elements Portable External Hard Drive - USB 3.0, Black","<a href=""https://www.amazon.it/dp/B06W55K9N6"">WD 2 TB Elements Portable External Hard Drive - USB 3.0, Black</a>","<a href=""https://www.amazon.it/dp/B06W55K9N6"">WD 2 TB Elements Portable External Hard Drive - USB 3.0, Black</a>"
"€0,038","€38,33",€115,3 TB,,"Internal 3.5""",HDD,Used,"Western Digital WD Red 3 TB NAS hard disk interno 3.5"", 5400 RPM Class, SATA 6 Gb/s, CMR, 64 MB Cache, WD30EFAX","<a href=""https://www.amazon.it/dp/B008JJLW4M"">Western Digital WD Red 3 TB NAS hard disk interno 3.5"", 5400 RPM Class, SATA 6 Gb/s, CMR, 64 MB Cache, WD30EFAX</a>","<a href=""https://www.amazon.it/dp/B008JJLW4M"">Western Digital WD Red 3 TB NAS hard disk interno 3.5"", 5400 RPM Class, SATA 6 Gb/s, CMR, 64 MB Cache, WD30EFAX</a>"
"€0,038","€38,33",€115,3 TB,,"Internal 3.5""",HDD,Used,"Western Digital WD30EFRX SATA lll Hard Drive per NAS 24x7, 3 TB, colore: Rosso [Importato da Regno Unito]","<a href=""https://www.amazon.it/dp/B00D0243C6"">Western Digital WD30EFRX SATA lll Hard Drive per NAS 24x7, 3 TB, colore: Rosso [Importato da Regno Unito]</a>","<a href=""https://www.amazon.it/dp/B00D0243C6"">Western Digital WD30EFRX SATA lll Hard Drive per NAS 24x7, 3 TB, colore: Rosso [Importato da Regno Unito]</a>"
"€0,039","€38,64",€155,4 TB,3 years,"External 3.5""",HDD,Used,"SanDisk Professional 4TB G-DRIVE ArmorATD, HDD portatile USB-C (5Gbps), USB 3.2 Gen 1, Thunderbolt 3, fino a 130 MB/s, resistente all'acqua e alla polvere, agli urti e alle cadute","<a href=""https://www.amazon.it/dp/B0C9YLX42J"">SanDisk Professional 4TB G-DRIVE ArmorATD, HDD portatile USB-C (5Gbps), USB 3.2 Gen 1, Thunderbolt 3, fino a 130 MB/s, resistente all'acqua e alla polvere, agli urti e alle cadute</a>","<a href=""https://www.amazon.it/dp/B0C9YLX42J"">SanDisk Professional 4TB G-DRIVE ArmorATD, HDD portatile USB-C (5Gbps), USB 3.2 Gen 1, Thunderbolt 3, fino a 130 MB/s, resistente all'acqua e alla polvere, agli urti e alle cadute</a>"
"€0,039","€38,78",€19,500 GB,,"Internal 2.5""",HDD,New,Toshiba 500gb MQ01ABD050 Hard Disk,"<a href=""https://www.amazon.it/dp/B0077IQ0AM"">Toshiba 500gb MQ01ABD050 Hard Disk</a>","<a href=""https://www.amazon.it/dp/B0077IQ0AM"">Toshiba 500gb MQ01ABD050 Hard Disk</a>"
"€0,039","€38,88",€39,1 TB,,"Internal 3.5""",HDD,Used,"Wester Digital WD10EZEX HDD Interno da 1 TB, Connettività: SATA, Dimensioni: 3.5"", Argento","<a href=""https://www.amazon.it/dp/B0711YN12S"">Wester Digital WD10EZEX HDD Interno da 1 TB, Connettività: SATA, Dimensioni: 3.5"", Argento</a>","<a href=""https://www.amazon.it/dp/B0711YN12S"">Wester Digital WD10EZEX HDD Interno da 1 TB, Connettività: SATA, Dimensioni: 3.5"", Argento</a>"
"€0,039","€38,95",€39,1 TB,,Internal,SSD,New,"Integral V Series V2 PLUS SSD 1TB interno SATA III 2.5, fino a 550 MB/S in lettura 520 MB/S in scrittura","<a href=""https://www.amazon.it/dp/B0C69K5XV3"">Integral V Series V2 PLUS SSD 1TB interno SATA III 2.5, fino a 550 MB/S in lettura 520 MB/S in scrittura</a>"
"€0,039","€39,00",€39,1 TB,,"External 3.5""",HDD,Used,"Sonnics 1TB USB 3.1 Tipo C Esterni Portatile Hard-Disk per Finestre PC, Mac, Smart TV, XBOX ONE/Serie X & PS4 /PS5, Grigio","<a href=""https://www.amazon.it/dp/B0B3FBZHBB"">Sonnics 1TB USB 3.1 Tipo C Esterni Portatile Hard-Disk per Finestre PC, Mac, Smart TV, XBOX ONE/Serie X & PS4 /PS5, Grigio</a>","<a href=""https://www.amazon.it/dp/B0B3FBZHBB"">Sonnics 1TB USB 3.1 Tipo C Esterni Portatile Hard-Disk per Finestre PC, Mac, Smart TV, XBOX ONE/Serie X & PS4 /PS5, Grigio</a>"
"€0,039","€39,00",€156,4 TB,,"Internal 3.5""",HDD,New,WESTERN DIGITAL Rete 4 TB 6 Gb/s SATA HDD Marca,"<a href=""https://www.amazon.it/dp/B08HL1XH2S"">WESTERN DIGITAL Rete 4 TB 6 Gb/s SATA HDD Marca</a>"
"€0,039","€39,08",€78,2 TB,3 years,"External 3.5""",HDD,New,"WD 2TB My Passport HDD portatile USB 3.0 con software per gestione di dispositivi, backup e protezione tramite password - funziona con PC, Xbox X, Xbox S, PS4 and PS5 -Blu","<a href=""https://www.amazon.it/dp/B07VTGBWYH"">WD 2TB My Passport HDD portatile USB 3.0 con software per gestione di dispositivi, backup e protezione tramite password - funziona con PC, Xbox X, Xbox S, PS4 and PS5 -Blu</a>","<a href=""https://www.amazon.it/dp/B07VTGBWYH"">WD 2TB My Passport HDD portatile USB 3.0 con software per gestione di dispositivi, backup e protezione tramite password - funziona con PC, Xbox X, Xbox S, PS4 and PS5 -Blu</a>"
"€0,039","€39,16",€392,10 TB,,"Internal 3.5""",HDD,New,"Western Digital WD101KRYZ Hard Disk WD Gold di Classe Enterprise, 10 TB","<a href=""https://www.amazon.it/dp/B01IWCMS5M"">Western Digital WD101KRYZ Hard Disk WD Gold di Classe Enterprise, 10 TB</a>"
"€0,039","€39,20",€78,2 TB,,"Internal 3.5""",HDD,New,"Seagate SkyHawk, 2 TB, Hard Disk Interno per Applicazioni Video, Unità SATA 6 GBit/s, 3.5"", Cache 256 MB, 3 Anni servizi Rescue in-house, Pacchetto di Facile Apertura (ST2000VXZ17), Amazon Exclsusivo","<a href=""https://www.amazon.it/dp/B0BLT5G238"">Seagate SkyHawk, 2 TB, Hard Disk Interno per Applicazioni Video, Unità SATA 6 GBit/s, 3.5"", Cache 256 MB, 3 Anni servizi Rescue in-house, Pacchetto di Facile Apertura (ST2000VXZ17), Amazon Exclsusivo</a>"
"€0,039","€39,25",€157,4 TB,2 years,"Internal 3.5""",HDD,Used,"Seagate SkyHawk, 4TB, Hard Disk Interno per Applicazioni Video, Unità SATA 6GBit/s, 3.5"", Cache 256 MB, 3 Anni servizi Rescue in-house (ST4000VX016)","<a href=""https://www.amazon.it/dp/B09YNN2PKG"">Seagate SkyHawk, 4TB, Hard Disk Interno per Applicazioni Video, Unità SATA 6GBit/s, 3.5"", Cache 256 MB, 3 Anni servizi Rescue in-house (ST4000VX016)</a>","<a href=""https://www.amazon.it/dp/B09YNN2PKG"">Seagate SkyHawk, 4TB, Hard Disk Interno per Applicazioni Video, Unità SATA 6GBit/s, 3.5"", Cache 256 MB, 3 Anni servizi Rescue in-house (ST4000VX016)</a>"
"€0,040","€39,64",€159,4 TB,5 years,"Internal 3.5""",HDD,Used,"Seagate Exos 7E10, 4TB, Unità disco interna - 3,5” SATA da 6GBit/s, 7.200 giri/min, cache da 256 MB, 2M MTBF, per sistemi classe Enterprise e data center (ST4000NM004B)","<a href=""https://www.amazon.it/dp/B09FH8C4QS"">Seagate Exos 7E10, 4TB, Unità disco interna - 3,5” SATA da 6GBit/s, 7.200 giri/min, cache da 256 MB, 2M MTBF, per sistemi classe Enterprise e data center (ST4000NM004B)</a>","<a href=""https://www.amazon.it/dp/B09FH8C4QS"">Seagate Exos 7E10, 4TB, Unità disco interna - 3,5” SATA da 6GBit/s, 7.200 giri/min, cache da 256 MB, 2M MTBF, per sistemi classe Enterprise e data center (ST4000NM004B)</a>"
"€0,040","€39,80",€20,500 GB,,"Internal 2.5""",HDD,Used,"Seagate ST500LM021 HDD Interno da 2.5"", Nero","<a href=""https://www.amazon.it/dp/B00II56U0I"">Seagate ST500LM021 HDD Interno da 2.5"", Nero</a>","<a href=""https://www.amazon.it/dp/B00II56U0I"">Seagate ST500LM021 HDD Interno da 2.5"", Nero</a>"
"€0,040","€39,86",€199,5 TB,,"External 2.5""",HDD,New,"Seagate Game Drive for PS5, 5 TB, Unità SSD esterna, 2.5"", USB 3.0, licenza ufficiale, LED blu (STLV5000200)","<a href=""https://www.amazon.it/dp/B0BHJKZ8SD"">Seagate Game Drive for PS5, 5 TB, Unità SSD esterna, 2.5"", USB 3.0, licenza ufficiale, LED blu (STLV5000200)</a>"
"€0,040","€39,90",€40,1 TB,,"Internal 3.5""",HDD,Used,"Western Digital WD Purple HDD Interno 1000 GB, SATA III, 6000 Mbit/s, 5400 rpm, 64 MB, 3.50 Pollici","<a href=""https://www.amazon.it/dp/B00IMPO5VU"">Western Digital WD Purple HDD Interno 1000 GB, SATA III, 6000 Mbit/s, 5400 rpm, 64 MB, 3.50 Pollici</a>","<a href=""https://www.amazon.it/dp/B00IMPO5VU"">Western Digital WD Purple HDD Interno 1000 GB, SATA III, 6000 Mbit/s, 5400 rpm, 64 MB, 3.50 Pollici</a>"
"€0,040","€39,94",€80,2 TB,5 years,Internal,SAS,New,"Seagate Exos 7E10, 2TB, Unità disco interna - 3,5” SAS da 12GBit/s, 7.200 giri/min, cache da 256 MB, 2M MTBF, per sistemi classe Enterprise e data center (ST2000NM001B)","<a href=""https://www.amazon.it/dp/B09FH79Q1K"">Seagate Exos 7E10, 2TB, Unità disco interna - 3,5” SAS da 12GBit/s, 7.200 giri/min, cache da 256 MB, 2M MTBF, per sistemi classe Enterprise e data center (ST2000NM001B)</a>"
"€0,040","€39,99",€40,1 TB,,"Internal 3.5""",HDD,Used,"Seagate Barracuda ST1000DM003 Hard disk interno 1TB 7200 RPM 64MB Cache SATA 6.0Gb/s 3.5""","<a href=""https://www.amazon.it/dp/B005T3GRNW"">Seagate Barracuda ST1000DM003 Hard disk interno 1TB 7200 RPM 64MB Cache SATA 6.0Gb/s 3.5""</a>","<a href=""https://www.amazon.it/dp/B005T3GRNW"">Seagate Barracuda ST1000DM003 Hard disk interno 1TB 7200 RPM 64MB Cache SATA 6.0Gb/s 3.5""</a>"
"€0,040","€39,99",€40,1 TB,,"Internal 2.5""",HDD,New,"Toshiba 1TB SATA 2.5""","<a href=""https://www.amazon.it/dp/B0089NK7TO"">Toshiba 1TB SATA 2.5""</a>"
"€0,040","€40,00",€20,500 GB,,"Internal 3.5""",HDD,Used,SEAGATE ST500DM002 Barracuda 7200.12 500GB 7200 RPM 16MB cache SATA 6.0Gb/s 3.5 hard disk interno (Bare Drive) (Ricondizionato),"<a href=""https://www.amazon.it/dp/B07MX8GH2F"">SEAGATE ST500DM002 Barracuda 7200.12 500GB 7200 RPM 16MB cache SATA 6.0Gb/s 3.5 hard disk interno (Bare Drive) (Ricondizionato)</a>"
"€0,040","€40,00",€80,2 TB,,"Internal 3.5""",HDD,Used,Western Digital WD2000F9YZ SE HardDisk,"<a href=""https://www.amazon.it/dp/B00CYSYZTS"">Western Digital WD2000F9YZ SE HardDisk</a>","<a href=""https://www.amazon.it/dp/B00CYSYZTS"">Western Digital WD2000F9YZ SE HardDisk</a>"
"€0,040","€40,00",€80,2 TB,,Internal,SAS,New,"Seagate Constellation SAS 2 TB 3.5"" 2048 GB","<a href=""https://www.amazon.it/dp/B003IT70K8"">Seagate Constellation SAS 2 TB 3.5"" 2048 GB</a>"
"€0,040","€40,06",€80,2 TB,,"External 3.5""",HDD,New,"Intenso Memory Drive - 2, 5' External hard drive 2 TB","<a href=""https://www.amazon.it/dp/B073P9L81C"">Intenso Memory Drive - 2, 5' External hard drive 2 TB</a>"
"€0,040","€40,25",€161,4 TB,3 years,"External 3.5""",HDD,New,"SanDisk Professional 4TB G-DRIVE ArmorATD, HDD portatile USB-C (5Gbps), USB 3.2 Gen 1, Thunderbolt 3, fino a 130 MB/s, resistente all'acqua e alla polvere, agli urti e alle cadute","<a href=""https://www.amazon.it/dp/B0C9YLX42J"">SanDisk Professional 4TB G-DRIVE ArmorATD, HDD portatile USB-C (5Gbps), USB 3.2 Gen 1, Thunderbolt 3, fino a 130 MB/s, resistente all'acqua e alla polvere, agli urti e alle cadute</a>","<a href=""https://www.amazon.it/dp/B0C9YLX42J"">SanDisk Professional 4TB G-DRIVE ArmorATD, HDD portatile USB-C (5Gbps), USB 3.2 Gen 1, Thunderbolt 3, fino a 130 MB/s, resistente all'acqua e alla polvere, agli urti e alle cadute</a>"
"€0,041","€40,50",€40,1 TB,,"Internal 3.5""",HDD,Used,Western Digital WD10EURX Hard Disk,"<a href=""https://www.amazon.it/dp/B006IMFT32"">Western Digital WD10EURX Hard Disk</a>","<a href=""https://www.amazon.it/dp/B006IMFT32"">Western Digital WD10EURX Hard Disk</a>"
"€0,041","€40,99",€41,1 TB,,"Internal 3.5""",HDD,Used,"Western Digital WD10SPZX - Hard disk da 1 TB, 2,5"" SATA III","<a href=""https://www.amazon.it/dp/B07FD1N16Y"">Western Digital WD10SPZX - Hard disk da 1 TB, 2,5"" SATA III</a>","<a href=""https://www.amazon.it/dp/B07FD1N16Y"">Western Digital WD10SPZX - Hard disk da 1 TB, 2,5"" SATA III</a>"
"€0,041","€41,10",€82,2 TB,,"External 2.5""",HDD,New,Transcend Hard Disk Esterno Portatile StoreJet SJ25M3 USB 3.1 Gen 1 2TB - TS2TSJ25M3S,"<a href=""https://www.amazon.it/dp/B07B4KXTQK"">Transcend Hard Disk Esterno Portatile StoreJet SJ25M3 USB 3.1 Gen 1 2TB - TS2TSJ25M3S</a>"
"€0,041","€41,17",€124,3 TB,,"Internal 3.5""",HDD,New,"Western Digital RE Western Digital3000FYYZ HDD, 3 TB, Nero","<a href=""https://www.amazon.it/dp/B0090UFITO"">Western Digital RE Western Digital3000FYYZ HDD, 3 TB, Nero</a>","<a href=""https://www.amazon.it/dp/B0090UFITO"">Western Digital RE Western Digital3000FYYZ HDD, 3 TB, Nero</a>"
"€0,041","€41,39",€83,2 TB,,"Internal 3.5""",HDD,New,"Seagate BarraCuda, 2 TB, Hard Disk Interno, SATA da 6 GBit/s, 3,5"", 7.200 RPM, Cache da 64 MB per PC Desktop, Pacchetto di Facile Apertura (ST2000DMZ008), Amazon Exclsusivo","<a href=""https://www.amazon.it/dp/B07H2RR55Q"">Seagate BarraCuda, 2 TB, Hard Disk Interno, SATA da 6 GBit/s, 3,5"", 7.200 RPM, Cache da 64 MB per PC Desktop, Pacchetto di Facile Apertura (ST2000DMZ008), Amazon Exclsusivo</a>"
"€0,041","€41,40",€21,500 GB,,"Internal 2.5""",HDD,New,Seagate ST500LT012 Momentus THIN HardDisk,"<a href=""https://www.amazon.it/dp/B008BG62A2"">Seagate ST500LT012 Momentus THIN HardDisk</a>","<a href=""https://www.amazon.it/dp/B008BG62A2"">Seagate ST500LT012 Momentus THIN HardDisk</a>"
"€0,042","€41,69",€125,3 TB,,"Internal 3.5""",HDD,New,Seagate Compatibile IronWolf ST3000VN006 - Festplatte - 3 TB - SATA 6Gb/s,"<a href=""https://www.amazon.it/dp/B09T74K5TF"">Seagate Compatibile IronWolf ST3000VN006 - Festplatte - 3 TB - SATA 6Gb/s</a>","<a href=""https://www.amazon.it/dp/B09T74K5TF"">Seagate Compatibile IronWolf ST3000VN006 - Festplatte - 3 TB - SATA 6Gb/s</a>"
"€0,042","€41,78",€167,4 TB,3 years,"Internal 3.5""",HDD,Used,"WD Red Plus, 4TB, NAS 3.5"" Disco Rigido Interno - Classe 5.400 RPM, SATA 6 GB/S, CMR, Cache 64 MB","<a href=""https://www.amazon.it/dp/B08L3H51DX"">WD Red Plus, 4TB, NAS 3.5"" Disco Rigido Interno - Classe 5.400 RPM, SATA 6 GB/S, CMR, Cache 64 MB</a>","<a href=""https://www.amazon.it/dp/B08L3H51DX"">WD Red Plus, 4TB, NAS 3.5"" Disco Rigido Interno - Classe 5.400 RPM, SATA 6 GB/S, CMR, Cache 64 MB</a>"
"€0,042","€41,90",€168,4 TB,2 years,"External 3.5""",HDD,New,"Seagate Game Drive for Xbox, 4TB, External Hard Drive Portable, USB 3.2 Gen 1, Black with built-in green LED bar, Xbox Certified, 2 year Rescue Services (STKX4000402)","<a href=""https://www.amazon.it/dp/B08Y1QRTBM"">Seagate Game Drive for Xbox, 4TB, External Hard Drive Portable, USB 3.2 Gen 1, Black with built-in green LED bar, Xbox Certified, 2 year Rescue Services (STKX4000402)</a>","<a href=""https://www.amazon.it/dp/B08Y1QRTBM"">Seagate Game Drive for Xbox, 4TB, External Hard Drive Portable, USB 3.2 Gen 1, Black with built-in green LED bar, Xbox Certified, 2 year Rescue Services (STKX4000402)</a>"
"€0,042","€42,04",€84,2 TB,2 years,"External 2.5""",HDD,New,"Toshiba 2TB Canvio Flex Portable External Hard Drive for Mac, Windows PC and Tablet use, compatible with most USB-C and USB-A devices, Silver (HDTX120ESCAA)","<a href=""https://www.amazon.it/dp/B08J4B9WMC"">Toshiba 2TB Canvio Flex Portable External Hard Drive for Mac, Windows PC and Tablet use, compatible with most USB-C and USB-A devices, Silver (HDTX120ESCAA)</a>"
"€0,042","€42,24",€21,500 GB,,"Internal 2.5""",HDD,Used,Toshiba 500gb MQ01ABD050 Hard Disk,"<a href=""https://www.amazon.it/dp/B0077IQ0AM"">Toshiba 500gb MQ01ABD050 Hard Disk</a>","<a href=""https://www.amazon.it/dp/B0077IQ0AM"">Toshiba 500gb MQ01ABD050 Hard Disk</a>"
"€0,042","€42,25",€169,4 TB,2 years,"External 3.5""",HDD,Used,"Seagate Game Drive for Xbox, 4TB, External Hard Drive Portable, USB 3.2 Gen 1, Black with built-in green LED bar, Xbox Certified, 2 year Rescue Services (STKX4000402)","<a href=""https://www.amazon.it/dp/B08Y1QRTBM"">Seagate Game Drive for Xbox, 4TB, External Hard Drive Portable, USB 3.2 Gen 1, Black with built-in green LED bar, Xbox Certified, 2 year Rescue Services (STKX4000402)</a>","<a href=""https://www.amazon.it/dp/B08Y1QRTBM"">Seagate Game Drive for Xbox, 4TB, External Hard Drive Portable, USB 3.2 Gen 1, Black with built-in green LED bar, Xbox Certified, 2 year Rescue Services (STKX4000402)</a>"
"€0,042","€42,41",€170,4 TB,2 years,"External 3.5""",HDD,Used,"Seagate Game Drive per console PlayStation, 4TB, Hard Disk Esterni - USB 3.2 Gen 1, con licenza ufficiale (STLL4000200)","<a href=""https://www.amazon.it/dp/B09SQ89XJY"">Seagate Game Drive per console PlayStation, 4TB, Hard Disk Esterni - USB 3.2 Gen 1, con licenza ufficiale (STLL4000200)</a>"
"€0,042","€42,50",€85,2 TB,,"External 2.5""",HDD,New,"WD Elements Portable HDD Esterno 2000 GB, 3.5 Pollici, USB 3.0, Compatibilita' Mac, Nero","<a href=""https://www.amazon.it/dp/B00D0L5BH8"">WD Elements Portable HDD Esterno 2000 GB, 3.5 Pollici, USB 3.0, Compatibilita' Mac, Nero</a>"
"€0,042","€42,50",€85,2 TB,2 years,"External 2.5""",HDD,New,"Toshiba 2TB Canvio Gaming - Portable External Hard Drive compatible with most PlayStation, Xbox and PC consoles, USB 3.2. Gen 1 Technology, Black (HDTX120EK3AA)","<a href=""https://www.amazon.it/dp/B08J49VF2Z"">Toshiba 2TB Canvio Gaming - Portable External Hard Drive compatible with most PlayStation, Xbox and PC consoles, USB 3.2. Gen 1 Technology, Black (HDTX120EK3AA)</a>"
"€0,043","€43,09",€431,10 TB,2 years,"Internal 3.5""",HDD,New,"WD_BLACK 10TB Hard Disk interno da 3.5” ad Alte Prestazioni, 7200 RPM Class, SATA 6 GB/s, 256MB Cache, Garanzia 5 anni","<a href=""https://www.amazon.it/dp/B08MKJPFZ7"">WD_BLACK 10TB Hard Disk interno da 3.5” ad Alte Prestazioni, 7200 RPM Class, SATA 6 GB/s, 256MB Cache, Garanzia 5 anni</a>"
"€0,044","€43,64",€349,8 TB,,"Internal 3.5""",HDD,New,"WD Red Pro NAS WD8003FFBX - Hard disk interno, 8 TB, 3,5"", SATA 6 GB/S, 7200 rpm, buffer: 256 MB","<a href=""https://www.amazon.it/dp/B07WXLKBXT"">WD Red Pro NAS WD8003FFBX - Hard disk interno, 8 TB, 3,5"", SATA 6 GB/S, 7200 rpm, buffer: 256 MB</a>"
"€0,044","€43,78",€22,500 GB,,"Internal 3.5""",HDD,New,"Western Digital Occidentale AV-GP Digitale HDD Interno da 3,5"" da 500 GB, SATA, Buffer 32 MB, Nero","<a href=""https://www.amazon.it/dp/B002P3KO7O"">Western Digital Occidentale AV-GP Digitale HDD Interno da 3,5"" da 500 GB, SATA, Buffer 32 MB, Nero</a>","<a href=""https://www.amazon.it/dp/B002P3KO7O"">Western Digital Occidentale AV-GP Digitale HDD Interno da 3,5"" da 500 GB, SATA, Buffer 32 MB, Nero</a>"
"€0,044","€44,44",€178,4 TB,5 years,"Internal 3.5""",HDD,New,"Seagate Exos 7E10, 4TB, Unità disco interna - 3,5” SATA da 6GBit/s, 7.200 giri/min, cache da 256 MB, 2M MTBF, per sistemi classe Enterprise e data center (ST4000NM004B)","<a href=""https://www.amazon.it/dp/B09FH8C4QS"">Seagate Exos 7E10, 4TB, Unità disco interna - 3,5” SATA da 6GBit/s, 7.200 giri/min, cache da 256 MB, 2M MTBF, per sistemi classe Enterprise e data center (ST4000NM004B)</a>","<a href=""https://www.amazon.it/dp/B09FH8C4QS"">Seagate Exos 7E10, 4TB, Unità disco interna - 3,5” SATA da 6GBit/s, 7.200 giri/min, cache da 256 MB, 2M MTBF, per sistemi classe Enterprise e data center (ST4000NM004B)</a>"
"€0,045","€44,80",€90,2 TB,,"External 2.5""",HDD,New,"TOSHIBA Canvio Basics HDTB520EK3AA - Hard disk esterno portatile USB 3.0, 2 TB, colore: Nero","<a href=""https://www.amazon.it/dp/B0BQX6NNVC"">TOSHIBA Canvio Basics HDTB520EK3AA - Hard disk esterno portatile USB 3.0, 2 TB, colore: Nero</a>"
"€0,045","€44,98",€22,500 GB,,"Internal 2.5""",HDD,New,Western Digital WD5000LUCT AV-25 HardDisk,"<a href=""https://www.amazon.it/dp/B00AY9ZXJU"">Western Digital WD5000LUCT AV-25 HardDisk</a>","<a href=""https://www.amazon.it/dp/B00AY9ZXJU"">Western Digital WD5000LUCT AV-25 HardDisk</a>"
"€0,045","€45,00",€90,2 TB,,"Internal 3.5""",HDD,New,Seagate IronWolf 2TB 256MB 3.5 Zoll SATA 6Gb/s Interno CMR NAS Festplatte,"<a href=""https://www.amazon.it/dp/B0BNGNB5HB"">Seagate IronWolf 2TB 256MB 3.5 Zoll SATA 6Gb/s Interno CMR NAS Festplatte</a>","<a href=""https://www.amazon.it/dp/B0BNGNB5HB"">Seagate IronWolf 2TB 256MB 3.5 Zoll SATA 6Gb/s Interno CMR NAS Festplatte</a>"
"€0,045","€45,44",€91,2 TB,,"Internal 3.5""",HDD,Used,"Seagate BarraCuda, 2 TB, Hard Disk Interno, SATA da 6 GBit/s, 3,5"", 7.200 RPM, Cache da 64 MB per PC Desktop, ST2000DM008","<a href=""https://www.amazon.it/dp/B01ICLGJF8"">Seagate BarraCuda, 2 TB, Hard Disk Interno, SATA da 6 GBit/s, 3,5"", 7.200 RPM, Cache da 64 MB per PC Desktop, ST2000DM008</a>","<a href=""https://www.amazon.it/dp/B01ICLGJF8"">Seagate BarraCuda, 2 TB, Hard Disk Interno, SATA da 6 GBit/s, 3,5"", 7.200 RPM, Cache da 64 MB per PC Desktop, ST2000DM008</a>"
"€0,046","€45,59",€228,5 TB,,"Internal 3.5""",HDD,New,Seagate Personal Cloud - Unità NAS da 5 TB,"<a href=""https://www.amazon.it/dp/B00U8X9ZTQ"">Seagate Personal Cloud - Unità NAS da 5 TB</a>"
"€0,046","€45,99",€46,1 TB,,"Internal 3.5""",HDD,Used,"WD Disco rigido 10PURZ, 3,5"", SATA 6Gb/s, 1TB, 64MB Cache, 24x7, ottimizzato per videosorveglianza","<a href=""https://www.amazon.it/dp/B073GVQGQ2"">WD Disco rigido 10PURZ, 3,5"", SATA 6Gb/s, 1TB, 64MB Cache, 24x7, ottimizzato per videosorveglianza</a>","<a href=""https://www.amazon.it/dp/B073GVQGQ2"">WD Disco rigido 10PURZ, 3,5"", SATA 6Gb/s, 1TB, 64MB Cache, 24x7, ottimizzato per videosorveglianza</a>"
"€0,046","€46,08",€46,1 TB,,"External 3.5""",HDD,New,"Sonnics 1TB USB 3.0 Esterni Desktop Hard-Disk per Finestre PC, Mac, Smart TV, XBOX ONE & PS4, Rosso","<a href=""https://www.amazon.it/dp/B07SWRP987"">Sonnics 1TB USB 3.0 Esterni Desktop Hard-Disk per Finestre PC, Mac, Smart TV, XBOX ONE & PS4, Rosso</a>"
"€0,046","€46,44",€23,500 GB,,"Internal 2.5""",HDD,New,"Toshiba MQ01ABF050 HDD 2,5"" 500 GB, Nero","<a href=""https://www.amazon.it/dp/B00F60QH5G"">Toshiba MQ01ABF050 HDD 2,5"" 500 GB, Nero</a>","<a href=""https://www.amazon.it/dp/B00F60QH5G"">Toshiba MQ01ABF050 HDD 2,5"" 500 GB, Nero</a>"
"€0,047","€47,40",€47,1 TB,,"External 3.5""",HDD,New,"Sonnics 1TB USB 3.0 Esterni Portatile Hard-Disk per Finestre PC, Mac, Smart TV, XBOX ONE & PS4, Nero","<a href=""https://www.amazon.it/dp/B094MHVN6H"">Sonnics 1TB USB 3.0 Esterni Portatile Hard-Disk per Finestre PC, Mac, Smart TV, XBOX ONE & PS4, Nero</a>"
"€0,047","€47,50",€95,2 TB,,"Internal 3.5""",HDD,Used,"WD Red Pro NAS WD2002FFSX - Hard disk interno, 2 TB, 3,5"", SATA 6GB/S, 7200 rpm, buffer: 64 MB","<a href=""https://www.amazon.it/dp/B07XH4QZG1"">WD Red Pro NAS WD2002FFSX - Hard disk interno, 2 TB, 3,5"", SATA 6GB/S, 7200 rpm, buffer: 64 MB</a>","<a href=""https://www.amazon.it/dp/B07XH4QZG1"">WD Red Pro NAS WD2002FFSX - Hard disk interno, 2 TB, 3,5"", SATA 6GB/S, 7200 rpm, buffer: 64 MB</a>"
"€0,048","€47,59",€48,1 TB,,"External 3.5""",HDD,New,"Sonnics 1TB USB 3.1 Tipo C Esterni Portatile Hard-Disk per Finestre PC, Mac, Smart TV, XBOX ONE/Serie X & PS4 /PS5, Grigio","<a href=""https://www.amazon.it/dp/B0B3FBZHBB"">Sonnics 1TB USB 3.1 Tipo C Esterni Portatile Hard-Disk per Finestre PC, Mac, Smart TV, XBOX ONE/Serie X & PS4 /PS5, Grigio</a>","<a href=""https://www.amazon.it/dp/B0B3FBZHBB"">Sonnics 1TB USB 3.1 Tipo C Esterni Portatile Hard-Disk per Finestre PC, Mac, Smart TV, XBOX ONE/Serie X & PS4 /PS5, Grigio</a>"
"€0,048","€47,67",€143,3 TB,,"Internal 3.5""",HDD,New,"Western - SATA Enterprise da 3 TB, 6 Gb/s, 7200 rpm, cache bare 64 MB, WD3000FYYZ","<a href=""https://www.amazon.it/dp/B00WZCES4A"">Western - SATA Enterprise da 3 TB, 6 Gb/s, 7200 rpm, cache bare 64 MB, WD3000FYYZ</a>","<a href=""https://www.amazon.it/dp/B00WZCES4A"">Western - SATA Enterprise da 3 TB, 6 Gb/s, 7200 rpm, cache bare 64 MB, WD3000FYYZ</a>"
"€0,048","€48,00",€96,2 TB,,"External 3.5""",HDD,New,Transcend Hard Disk Esterno Portatile StoreJet SJ25M3C USB 3.1 Gen 1 2TB - TS2TSJ25M3C,"<a href=""https://www.amazon.it/dp/B07RPW2ZXK"">Transcend Hard Disk Esterno Portatile StoreJet SJ25M3C USB 3.1 Gen 1 2TB - TS2TSJ25M3C</a>"
"€0,048","€48,24",€24,500 GB,,"Internal 3.5""",HDD,Used,"WD WD5000AAKX Blu Hard Disk Desktop da 500 GB, 7200 RPM, SATA 6 GB/s, 16 MB Cache, 3.5 ""","<a href=""https://www.amazon.it/dp/B00461G3MS"">WD WD5000AAKX Blu Hard Disk Desktop da 500 GB, 7200 RPM, SATA 6 GB/s, 16 MB Cache, 3.5 ""</a>","<a href=""https://www.amazon.it/dp/B00461G3MS"">WD WD5000AAKX Blu Hard Disk Desktop da 500 GB, 7200 RPM, SATA 6 GB/s, 16 MB Cache, 3.5 ""</a>"
"€0,048","€48,32",€48,1 TB,,"External 3.5""",HDD,New,"Sonnics 1TB USB 3.0 Esterni Pocket Hard-Disk per Finestre PC, Mac, XBOX ONE and PS4, Bianco","<a href=""https://www.amazon.it/dp/B07FSNRY51"">Sonnics 1TB USB 3.0 Esterni Pocket Hard-Disk per Finestre PC, Mac, XBOX ONE and PS4, Bianco</a>"
"€0,049","€49,00",€98,2 TB,,"Internal 3.5""",HDD,Used,"WD Red WD20EFRX, 24/7, NAS 3,5"", SATA III, fino a 7.200 giri/min, 64 MB, 2 TB Hard Disk","<a href=""https://www.amazon.it/dp/B010AQ11MY"">WD Red WD20EFRX, 24/7, NAS 3,5"", SATA III, fino a 7.200 giri/min, 64 MB, 2 TB Hard Disk</a>","<a href=""https://www.amazon.it/dp/B010AQ11MY"">WD Red WD20EFRX, 24/7, NAS 3,5"", SATA III, fino a 7.200 giri/min, 64 MB, 2 TB Hard Disk</a>"
"€0,049","€49,12",€25,500 GB,,"Internal 3.5""",HDD,Used,"Disco rigido per telecamere a circuito chiuso DVR SATA, 7200 giri/min, 3,5"" 500 GB","<a href=""https://www.amazon.it/dp/B004ORG2NY"">Disco rigido per telecamere a circuito chiuso DVR SATA, 7200 giri/min, 3,5"" 500 GB</a>","<a href=""https://www.amazon.it/dp/B004ORG2NY"">Disco rigido per telecamere a circuito chiuso DVR SATA, 7200 giri/min, 3,5"" 500 GB</a>"
"€0,049","€49,33",€148,3 TB,,"Internal 3.5""",HDD,New,"Western Digital WD Red Pro HDD Interno 3000 GB, SATA III, 6000 Mb/s, 7200 RPM, 64 MB, 3.50 Pollici","<a href=""https://www.amazon.it/dp/B00LO3KRHI"">Western Digital WD Red Pro HDD Interno 3000 GB, SATA III, 6000 Mb/s, 7200 RPM, 64 MB, 3.50 Pollici</a>","<a href=""https://www.amazon.it/dp/B00LO3KRHI"">Western Digital WD Red Pro HDD Interno 3000 GB, SATA III, 6000 Mb/s, 7200 RPM, 64 MB, 3.50 Pollici</a>"
